### DISCUSSION TITLE
FRITZ!Box 4050

### DISCUSSION THREAD

**Discussion by yeah-its-gloria** [Freetz-NG/freetz-ng#1179] [Allgemein] [answered]
Hi! Ich bin die komische Seele, die eine 4050 besitzt. Diese scheint noch als ungetestet zu zählen.
Ich hatte Freetz-NG erfolgreich kompilieren und flashen können, jedoch konnte das JUIS-Tool das Firmware-Image selber gar nicht finden. Ich musste den Link zur offiziellen Firmware per Hand in die URL-Datei schreiben.

![AVM-Info](https://github.com/user-attachments/assets/4198860a-d48c-4081-8018-c510b94a6885)
![Flashspeicher](https://github.com/user-attachments/assets/9b2122bc-af9a-477f-be1a-73cdcdf7a89c)

**Comment by fda77** [comment, marked as answer]
Danke! 42f4199551437471191b6ae855d5fe3f296fe51e

Hast du die mit push_firmware geflasht - und ohne besondere Parameter anzugeben?
https://github.com/Freetz-NG/freetz-ng/blob/master/tools/push_firmware#L845
Aktuell wird das Default `MAPSTART=0x40000000` verwendet

Von freetz wird momentan nichts für die 4050 via juis gefunden: https://freetz-ng.github.io/freetz-ng/juis/
Vermutlich hat avm etwas gewändert bzw erweitert. Vielleicht könntest du so eine Anfrage mal mitschneiden...

**Reply by yeah-its-gloria** [reply]
Ich hab einfach `push_firmware` ohne Parameter genutzt, genau.
Ich schau mal nach, was es mit dem JUIS-Kram auf sich hat. 🫡

**Comment by fda77** [comment]
Juis ging bisher immer unverschlüsselt über HTTP. Wenn du im AVM-Webif den Paketmittschnitt aktivierst und dann nach Updates suchst müsste im Capture was drin sein. Dies sollte man mit Wireguard öffnen und darin suchen können

**Comment by yeah-its-gloria** [comment]
<img width="845" alt="Wireshark" src="https://github.com/user-attachments/assets/1d0aae8c-ef8b-463d-928a-916af61a5b6b" />

**Comment by fda77** [comment]
Es wird wohl nicht mehr `<HWR>.jws.avm.de` sondern wie vermutet `jws.avm.de` genutzt.
Ausserdem offenbar wirklich Port 443, also HTTPS. dh "follow tcp stream" in wireshark bringt nichts mehr
Das öffentliche Zertifikat dafür sollte `/etc/avm_root_ca.pem` sein, evtl kann man das austauschen und auf einen anderen Server umleiten, das ist aber aufwändig

**Reply by LizenzFass78851** [reply]
Ich habe zwar keine 4050, habe aber dies trotzdem das mit juis testen wollen.

# Setup
  - Betreffende Fritzbox (**in meinen Fall** 7530 AX)
  - Vorgeschaltete Fritzbox (**in meinen Fall** 6490 Cable)
  - im Heimnetz (192.168.178.X) ein Linux Device mit Pihole und ein selbst konfigurierten Standard Nginx (als mini reverseproxy) mit Port 80 und 443 (beide Ports ohne SSL)

> [!IMPORTANT]
> ~~Es ist vielleicht auch möglich, den vorgelagerten Router wegzulassen, ich hatte das deshalb so getestet, weil ich nicht weiß, ob die in diesem Beispiel 7530 AX überhaupt die DNS-Server die man zuweist, anfragt oder ob die 7530 AX nur den von vorgelegten Netzwerk verwendet.~~
> **Edit:** Dieser Trick funktioniert mit pihole nur bis maximal Version 
> <ins>Docker Tag 2025.11.1, Core [v6.3](https://github.com/pi-hole/pi-hole/releases/v6.3), FTL [v6.4.1](https://github.com/pi-hole/FTL/releases/v6.4.1), Web interface [v6.4](https://github.com/pi-hole/web/releases/v6.4)</ins>

# Vorgehen
- 7530 AX als Router mit dem Netzbereich 192.168.188.X einrichten (erstmal ohne Internetzugriff und IPv6 deaktivieren)
- 6490 Cable als vorgeschalteten Router mit dem Netzbereich 192.168.198.X einrichten (diese soll Internetzugriff per LAN1 von Heimnetz erhalten und auch da, IPv6 deaktivieren)
- 7530 AX einstellen so dass diese mit dem Internetzugriff per LAN1 von dem vorgeschalteten Router (6490 Cable) erhalten kann
- Im Heimnetz das Linux Device mit den nginx mit den Ports wie oben genannt und pihole einrichten.
  - beim pihole muss 'jws.avm.de' als lokalen DNS record angelegt werden und auf die IP-Adresse des Linux Device was neben pihole auch den nginx läuft eintragen
- Bei 7530 AX und 6490 Cable die IP des pihole als Lokalen DNS-Server (unter den Menüpunkt - Heimnetz) und als DNS-Server (unter den Menüpunkt - Internet) eintragen
- die 7530 AX neu starten, damit der DNS Cache geleert wird
- Dann bei 7530 unter Support -> Mitschneiden die Routingschnittstelle mitschneiden starten
- Danach unter Updates, die Update suche, starten.
  - Passieren wird folgendes: Die fritzbox 7530 AX fragt das pihole nach den A Record von jws.avm.de. Beim Pihole ist diese als Lokalen DNS Record angelegt und dadurch bekommt es die IP des Lokalen Webservers im Heimnetz, was dasselbe Gerät ist in den auch Pihole läuft. Danach fragt es den Webserver 2-mal nach, ob eine SSL-Verbindung möglich ist. Da der nginx mit Port 443 wie auch bei Port 80 kein SSL aktiviert ist, bekommt es auch keine Möglichkeit eine verschlüsselte Verbindung aufzubauen (als Antwort kommt bad request). Danach probiert die fritzbox 7530 AX Port 80. Ab da kann die Abfrage mitgeschnitten werden.

# Inhalte
<details>
  <summary>Wireshark Output</summary>

- Paketmitschnitt

```
5	10.464730	192.168.188.1	192.168.178.10	DNS	56	Standard query 0x61a0 AAAA jws.avm.de
6	10.465172	192.168.188.1	192.168.178.10	DNS	56	Standard query 0xd645 A jws.avm.de
7	10.472705	192.168.178.10	192.168.188.1	DNS	84	Standard query response 0x61a0 AAAA jws.avm.de AAAA 2001:bf0:244:244::78
8	10.473576	192.168.178.10	192.168.188.1	DNS	72	Standard query response 0xd645 A jws.avm.de A 192.168.178.10
9	10.474682	192.168.188.1	192.168.178.10	TCP	60	53685 → 443 [SYN] Seq=0 Win=64240 Len=0 MSS=1460 SACK_PERM TSval=2811961031 TSecr=0 WS=64
10	10.477386	192.168.178.10	192.168.188.1	TCP	60	443 → 53685 [SYN, ACK] Seq=0 Ack=1 Win=65160 Len=0 MSS=1460 SACK_PERM TSval=2059155595 TSecr=2811961031 WS=128
11	10.477700	192.168.188.1	192.168.178.10	TCP	52	53685 → 443 [ACK] Seq=1 Ack=1 Win=64256 Len=0 TSval=2811961034 TSecr=2059155595
12	10.479206	192.168.188.1	192.168.178.10	TLSv1	569	Client Hello (SNI=jws.avm.de)
13	10.482467	192.168.178.10	192.168.188.1	TCP	52	443 → 53685 [ACK] Seq=1 Ack=518 Win=64768 Len=0 TSval=2059155600 TSecr=2811961035
14	10.482711	192.168.178.10	192.168.188.1	HTTP	361	HTTP/1.1 400 Bad Request  (text/html)
15	10.482836	192.168.188.1	192.168.178.10	TCP	52	53685 → 443 [ACK] Seq=518 Ack=310 Win=64128 Len=0 TSval=2811961039 TSecr=2059155600
16	10.482997	192.168.178.10	192.168.188.1	TCP	52	443 → 53685 [FIN, ACK] Seq=310 Ack=518 Win=64768 Len=0 TSval=2059155600 TSecr=2811961035
17	10.484252	192.168.188.1	192.168.178.10	TCP	60	44579 → 443 [SYN] Seq=0 Win=64240 Len=0 MSS=1460 SACK_PERM TSval=2811961040 TSecr=0 WS=64
18	10.484569	192.168.188.1	192.168.178.10	TCP	52	53685 → 443 [RST, ACK] Seq=518 Ack=311 Win=64128 Len=0 TSval=2811961040 TSecr=2059155600
19	10.487522	192.168.178.10	192.168.188.1	TCP	60	443 → 44579 [SYN, ACK] Seq=0 Ack=1 Win=65160 Len=0 MSS=1460 SACK_PERM TSval=2059155605 TSecr=2811961040 WS=128
20	10.487892	192.168.188.1	192.168.178.10	TCP	52	44579 → 443 [ACK] Seq=1 Ack=1 Win=64256 Len=0 TSval=2811961044 TSecr=2059155605
21	10.489347	192.168.188.1	192.168.178.10	TLSv1	569	Client Hello (SNI=jws.avm.de)
22	10.492458	192.168.178.10	192.168.188.1	TCP	52	443 → 44579 [ACK] Seq=1 Ack=518 Win=64768 Len=0 TSval=2059155610 TSecr=2811961045
23	10.492710	192.168.178.10	192.168.188.1	HTTP	361	HTTP/1.1 400 Bad Request  (text/html)
24	10.492835	192.168.188.1	192.168.178.10	TCP	52	44579 → 443 [ACK] Seq=518 Ack=310 Win=64128 Len=0 TSval=2811961049 TSecr=2059155610
25	10.493003	192.168.178.10	192.168.188.1	TCP	52	443 → 44579 [FIN, ACK] Seq=310 Ack=518 Win=64768 Len=0 TSval=2059155610 TSecr=2811961045
26	10.493649	192.168.188.1	192.168.178.10	TCP	52	44579 → 443 [RST, ACK] Seq=518 Ack=311 Win=64128 Len=0 TSval=2811961050 TSecr=2059155610
27	10.494350	192.168.188.1	192.168.178.10	DNS	56	Standard query 0xb07a AAAA jws.avm.de
28	10.494614	192.168.188.1	192.168.178.10	DNS	56	Standard query 0xb459 A jws.avm.de
29	10.497451	192.168.178.10	192.168.188.1	DNS	84	Standard query response 0xb07a AAAA jws.avm.de AAAA 2001:bf0:244:244::78
30	10.498680	192.168.178.10	192.168.188.1	DNS	72	Standard query response 0xb459 A jws.avm.de A 192.168.178.10
31	10.499628	192.168.188.1	192.168.178.10	TCP	60	50945 → 80 [SYN] Seq=0 Win=64240 Len=0 MSS=1460 SACK_PERM TSval=2811961055 TSecr=0 WS=64
32	10.502020	192.168.178.10	192.168.188.1	TCP	60	80 → 50945 [SYN, ACK] Seq=0 Ack=1 Win=65160 Len=0 MSS=1460 SACK_PERM TSval=2059155620 TSecr=2811961055 WS=128
33	10.502346	192.168.188.1	192.168.178.10	TCP	52	50945 → 80 [ACK] Seq=1 Ack=1 Win=64256 Len=0 TSval=2811961058 TSecr=2059155620
34	10.503228	192.168.188.1	192.168.178.10	TCP	1076	50945 → 80 [PSH, ACK] Seq=1 Ack=1 Win=64256 Len=1024 TSval=2811961059 TSecr=2059155620 [TCP PDU reassembled in 36]
35	10.506581	192.168.178.10	192.168.188.1	TCP	52	80 → 50945 [ACK] Seq=1 Ack=1025 Win=64256 Len=0 TSval=2059155624 TSecr=2811961059
36	10.506913	192.168.188.1	192.168.178.10	HTTP/XML	280	POST /Jason/UpdateInfoService HTTP/1.1 
37	10.509375	192.168.178.10	192.168.188.1	TCP	52	80 → 50945 [ACK] Seq=1 Ack=1253 Win=64128 Len=0 TSval=2059155627 TSecr=2811961063
38	10.599292	192.168.178.10	192.168.188.1	TCP	1500	80 → 50945 [ACK] Seq=1 Ack=1253 Win=64128 Len=1448 TSval=2059155717 TSecr=2811961063 [TCP PDU reassembled in 40]
39	10.599613	192.168.188.1	192.168.178.10	TCP	52	50945 → 80 [ACK] Seq=1253 Ack=1449 Win=64128 Len=0 TSval=2811961155 TSecr=2059155717
40	10.599796	192.168.178.10	192.168.188.1	HTTP/XML	653	HTTP/1.1 200 OK 
41	10.600018	192.168.188.1	192.168.178.10	TCP	52	50945 → 80 [ACK] Seq=1253 Ack=2050 Win=63552 Len=0 TSval=2811961156 TSecr=2059155717
42	10.619607	192.168.188.1	192.168.178.10	TCP	52	50945 → 80 [FIN, ACK] Seq=1253 Ack=2050 Win=64128 Len=0 TSval=2811961175 TSecr=2059155717
43	10.621902	192.168.178.10	192.168.188.1	TCP	52	80 → 50945 [FIN, ACK] Seq=2050 Ack=1254 Win=64128 Len=0 TSval=2059155740 TSecr=2811961175
44	10.622222	192.168.188.1	192.168.178.10	TCP	52	50945 → 80 [ACK] Seq=1254 Ack=2051 Win=64128 Len=0 TSval=2811961178 TSecr=2059155740
```

- TCP Stream der juis-Anfrage

```
POST /Jason/UpdateInfoService HTTP/1.1
Host: jws.avm.de:80
Content-Length: 1126
Content-Type: text/xml; charset="utf-8"


<soap:Envelope xmlns:soap="http://schemas.xmlsoap.org/soap/envelope/" xmlns:soap-enc="http://schemas.xmlsoap.org/soap/encoding/" xmlns:xsi="http://www.w3.org/2001/XMLSchema-instance" xmlns:xsd="http://www.w3.org/2001/XMLSchema" xmlns:e="http://juis.avm.de/updateinfo" xmlns:q="http://juis.avm.de/request">
<soap:Header/>
<soap:Body>
<e:BoxFirmwareUpdateCheck>
<e:RequestHeader>
<q:Nonce>lm6ljUFqxHC25DszZPjffQ==</q:Nonce>
<q:UserAgent>Box</q:UserAgent>
<q:ManualRequest>true</q:ManualRequest></e:RequestHeader>
<e:BoxInfo>
<q:Name>FRITZ!Box 7530 AX (UI)</q:Name>
<q:HW>256</q:HW>
<q:Major>256</q:Major>
<q:Minor>8</q:Minor>
<q:Patch>2</q:Patch>
<q:Buildnumber>117981</q:Buildnumber>
<q:Buildtype>1</q:Buildtype>
<q:Serial>DC15********</q:Serial>
<q:OEM>1und1</q:OEM>
<q:Lang>de</q:Lang>
<q:Country>049</q:Country>
<q:Annex>B</q:Annex>
<q:Flag>crashreport</q:Flag>
<q:Flag>avm_acs</q:Flag>
<q:Flag>medium_lan</q:Flag>
<q:Flag>mesh_master_no_trusted</q:Flag>
<q:UpdateConfig>3</q:UpdateConfig>
<q:Provider>oma_lan</q:Provider>
<q:ProviderName></q:ProviderName></e:BoxInfo></e:BoxFirmwareUpdateCheck></soap:Body></soap:Envelope>
HTTP/1.1 200 OK
Server: nginx/1.27.5
Date: Mon, 23 Jun 2025 13:52:31 GMT
Content-Type: text/xml;charset=UTF-8
Content-Length: 1866
Connection: keep-alive
download-delay: 116

<soap:Envelope xmlns:soap="http://schemas.xmlsoap.org/soap/envelope/"><SOAP-ENV:Header xmlns:SOAP-ENV="http://schemas.xmlsoap.org/soap/envelope/"/><soap:Body ID="Body"><ns2:BoxFirmwareUpdateCheckResponse xmlns:ns2="http://juis.avm.de/updateinfo" xmlns:ns3="http://juis.avm.de/response" xmlns:ns4="http://juis.avm.de/request"><ns2:ResponseUpdateInfo><ns3:ResponseHeader><ns3:Nonce>lm6ljUFqxHC25DszZPjffQ==</ns3:Nonce></ns3:ResponseHeader><ns3:UpdateInfo><ns3:CheckInterval>48</ns3:CheckInterval><ns3:Found>false</ns3:Found><ns3:Version></ns3:Version><ns3:DownloadURL></ns3:DownloadURL><ns3:InfoURL></ns3:InfoURL><ns3:InfoText></ns3:InfoText><ns3:HintURL></ns3:HintURL><ns3:Priority>1</ns3:Priority><ns3:AutoUpdateStartTime>0</ns3:AutoUpdateStartTime><ns3:AutoUpdateEndTime>0</ns3:AutoUpdateEndTime><ns3:AutoUpdateKeepServices>true</ns3:AutoUpdateKeepServices></ns3:UpdateInfo></ns2:ResponseUpdateInfo></ns2:BoxFirmwareUpdateCheckResponse><Signature xmlns="http://www.w3.org/2000/09/xmldsig#"><SignedInfo><CanonicalizationMethod Algorithm="http://www.w3.org/2001/10/xml-exc-c14n#"/><SignatureMethod Algorithm="http://www.w3.org/2001/04/xmldsig-more#rsa-sha256"/><Reference URI="#Body"><Transforms><Transform Algorithm="http://www.w3.org/2000/09/xmldsig#enveloped-signature"/></Transforms><DigestMethod Algorithm="http://www.w3.org/2001/04/xmlenc#sha256"/><DigestValue>sMs/0QNVfcoO7yNUVv0t7mczhoy/sm+ck4mG7BHMM2g=</DigestValue></Reference></SignedInfo><SignatureValue>PTvlx3bZqmso6tbWrb/JyLqFFH/EfMGe2AN62dSuVpua2U4PgWIUUC1DyIpMyU/spU2j/VyJgAHkt1ymxqEVHnvg9ekWDkrwqTZElLjJoOwRF8VnGY5JwHwczbq00dqxF5MCfCOr469S/HOGN/NfBnMlePMkFWg+XwaZGBKJrGIQWJpiQiCfSrkp6GyIzpTwRU6YFW/5xTiI3Ow/aWf7ix8NBYcCpwEIQiq8J5mrAOTw4ly6Hqo+xOHZfNv8ybZvpfd19J6OWxfpR1MlJ4QkWudppSoeM/NFMU/+6m5i2jveE7rjq3kXl5ED2+6Z72FJQRzt2vGCJTjqtLsUTIxydw==</SignatureValue></Signature></soap:Body></soap:Envelope>
```

</details>


<details>
  <summary>Nginx config</summary>

- docker-compose.yml

```yml
services:
  nginx:
    image: nginx:latest
    restart: always
    ports:
      - "80:80"
      - "443:80"
    volumes:
      # nginx conf
      - ./nginx.conf:/etc/nginx/nginx.conf:ro
```

- nginx.conf

```json
events { }

http {
    server {
        listen 80;
        server_name jws.avm.de;

        location / {
            proxy_pass https://jws.avm.de:443;
            proxy_set_header Host $host;
            proxy_set_header X-Real-IP $remote_addr;
            proxy_set_header X-Forwarded-For $proxy_add_x_forwarded_for;
            proxy_set_header X-Forwarded-Proto $scheme;
        }
    }
}
```

</details>

<details>
  <summary>Pihole Einstellungen</summary>

**in meinen falle über Docker deployd**
Siehe: https://github.com/pi-hole/docker-pi-hole?tab=readme-ov-file#quick-start

- Lokaler DNS Record

![Screenshot 2025-06-23 at 16-18-42 Pi-hole pihole](https://github.com/user-attachments/assets/fae230a1-6c39-455a-8be5-fb749ab1c342)

</details>

<details>
  <summary>Topologie</summary>

- 7530 AX = Betreffender Router bezüglich des juis Tests
    - 192.168.188.0/24
- 6490 Cable = Vorgelagerter Router
    - 192.168.198.0/24
- Heimnetz =  Privates Heimnetz in den sich der Linux Device (pihole und nginx) befinden
    - 192.168.178.0/24

7530 AX -> 6490 Cable -> Heimnetz

- 7530 AX
    - Port1 > 6490 Cable
    - Port2 > PC1²
- 6490 Cable
    - Port1 > Heimnetz
    - Port2 > PC2²
    - Port3 > 7530 AX
- Heimnetz
    - Port01 > PC3²
    - Port02 > Linux Device
    - Port03 > 6490 Cable

² Kann auch ein PC mit 3 LAN Ports sein oder man nimmt einen PC und wechselt immer zwischen 7530 AX, 6490 Cable und Heimnetz

</details>

**Reply by fda77** [reply]
Genau, so irgend wie müsste jemand mit einem neueren Gerät das mit lesen.
Da netterweise nach https wohl http verwendet wird ist das recht einfach und könnte man auch einfach ausgehend 443 blockieren, das sollte sogar mit freetz-iptables möglich sein (solang es nichts mit "state" zu tun hat). Evlt noch avm's "PA" ausschalten.

"Neuere Geräte" bzw mit neuerer Juis-Abfragemethode sind auf jeden fall die für die es den Hostnamen `<HWR>.jws.avm.de` nicht gibt
Die HWR für alle Geräte findet man zb mit google oder im Freetz-Checkout mit: `grep HWR  config/.img/separate/* -A2 |grep default`

Für welche HWR (hier 222-300) es keinen eigenen Juis-Hostnamen mehr gibt findet man zb schnell mit 
`for x in $(seq 222 300); do  nslookup $x.jws.avm.de && echo NXDOMAINvalid-$x; done |grep NXDOMAIN`

Auf die Schnelle sollten es diese sein:
```
NAME                                HWR
GATE--08_0X.in-            default "265"
1240_W6--07_5X.in-         default "275"
6860--08_0X.in-            default "277"
7530_W6_V2--08_0X.in-      default "278"
5690_PRO--08_0X.in-        default "279"
6670--08_0X.in-            default "284"
7690--08_0X.in-            default "285"
7682--08_0X.in-            default "286"
4050--08_0X.in-            default "287"
4690--08_0X.in-            default "291"
5690_NIX--08_0X.in-        default "298"
```

Auf https://freetz-ng.github.io/freetz-ng/juis/ werden von diesen "neuen" keine firmware gefunden, abgesehen von HWR275

Das ganze ist hier zuerst aufgefallen: https://github.com/PeterPawn/YourFritz/issues/66

Den tcpdump-/Wireguard-Output würde ich als .cap speichern und dann über die GUI mit follow tcp-stream schauen was da via http verschickt wird

**Reply by LizenzFass78851** [reply]
> könnte man auch einfach ausgehend 443 blockieren

Port 443 über den vorgelagerten Router blockieren, hatte ich beim testen auch probiert aber dann versucht die in meinen Fall fritzbox 7530 AX nicht den Port 80 sondern erkennt es als "Der Server ist nicht da".
Daher der Trick mit dem Mini reverse proxy damit die fritzbox irgendwie port 443 ansprechen kann und aber überlistet wird in dem SSL (TLS) Auf port 443 deaktiviert ist, erst dann hat es zumindest in meinem tests den Port 80 angesprochen. Das macht die fritzbox in meinem Fall nicht wenn es auf Port 443 gar keine Verbindung aufbauen kann sondern nur wenn zumindest irgend eine wenn auch nicht SSL verschlüsselte Verbindung über port 443 aufgebaut wurde.

**Comment by fda77** [comment]
> Ich hab einfach push_firmware ohne Parameter genutzt

 - 95894172ad2fa71154528e6da2d5a82ad2904960

**Reply by yeah-its-gloria** [reply]
Sollte ich push_firmware jetzt nochmal testen?

**Reply by fda77** [reply]
Brauchst du eigentlich nicht, denn der Default für alle "fit" Geräte https://github.com/Freetz-NG/freetz-ng/blob/master/tools/push_firmware#L850 ist der der jetzt für die 4050 gesetzt ist: https://github.com/Freetz-NG/freetz-ng/blob/master/tools/push_firmware#L845
