### DISCUSSION TITLE
7690 mit ./tools/push_firmware flashen schlägt fehl

### DISCUSSION THREAD

**Discussion by Helmut1972** [Freetz-NG/freetz-ng#1053] [push firmware]
Hi,

frisch ausgepackte 7690. Die Box bootet zwar, aber Freetz-NG ist nicht drauf.

```
helmut@freetz:/home/freetz-ng/freetz-ng-7690$ ./tools/push_firmware

 * Analyzing 'images/7690_07.62.all_freetz-ng-24668M-2348ab24e7_20241016-170233.image' ...
 * Product: Fritz_Box_HW285 (FRITZ!Box 7690)
 * Using dos2unix binary: /usr/bin/dos2unix
 * Using tar binary: tools/tar-gnu
 * Using ftp binary: /usr/bin/tnftp
 * Target host: 192.168.178.1
 * Outgoing IP: 192.168.178.2
 * Flash mode: fit-boot
 * Allowed memory size: 1024 MB
 * Designated linux_fs_start: <other>

 !!! WARNING !!! WARNING !!! WARNING !!! WARNING !!! WARNING !!!
 !!!  THERE IS NO WARRANTY AT ALL !!! USE AT YOUR OWN RISK   !!!

 * Are you sure, that you want to flash this file to the device?
   images/7690_07.62.all_freetz-ng-24668M-2348ab24e7_20241016-170233.image
   Proceed? (y/[n]) y

 * You should now reboot your box (192.168.178.1). Waiting for shut down.
   Switch off, if reboot is not detected because it happens too quickly.
   Some newer bootloader versions allow to flash on power-cycle only.
   ..........................................................
 * No reply from box, assuming switch-off or restart. Trying to re-detect box.
   Waiting ................................ found!

 * Reading 'env' file to /tmp/freetz_env_U3W
Connected to 192.168.178.1.
220 ADAM2 FTP Server ready
331 Password required for adam2
230 User adam2 successfully logged in
Remote system type is AVM.
Debugging on (debug=1).
---> TYPE I
200 Type set to BINARY
---> SYST
215 AVM EVA Version 1.12673 0x0 0x4C6409
---> MEDIA SDRAM
200 Media set to MEDIA_SDRAM
local: /tmp/freetz_env_U3W remote: env
---> SIZE env
502 Command not implemented
ftp: setsockopt SO_DEBUG (ignored): Permission denied
---> EPSV
502 Command not implemented
disabling epsv4 for this connection
---> PASV
227 Entering Passive Mode (192,168,178,1,17,212)
---> RETR env
150 Opening BINARY data connection
Timeout!!!!!!!!!!!!!!!!!!
   ProductID:            Fritz_Box_HW285
   HWRevision:           285
   HWSubRevision:        2
   memsize:              0x40000000
   linux_fs_start:       1

 * MAPSTART=0x40000000
 * FULLSIZE=0x40000000   (1024 MB)
 * MAPLIMIT=0x80000000
 * FILESIZE=0x02d372c7   (~45 MB)
 * ALIBYTES=0x00008d39   (~35 kB)
 * FREESIZE=0x3d2c0000   (~978 MB)
 * MTDSTART=0x7d2c0000

 * Box is back up again, initiating transfer.

Connected to 192.168.178.1.
220 ADAM2 FTP Server ready
331 Password required for adam2
230 User adam2 successfully logged in
Remote system type is AVM.
Debugging on (debug=1).
---> TYPE I
200 Type set to BINARY
---> MEDIA SDRAM
200 Media set to MEDIA_SDRAM
---> SETENV memsize 0x3d2c0000
200 SETENV command successful
---> SETENV kernel_args_tmp "avm_fwupdate mtdram1=0x7d2c0000,0x80000000 mtdparts_ext=update-image.0:0x2d372c7@0x0(fit-image)"
200 SETENV command successful
local: /tmp/freetz_KKg/fitboot.flash remote: 0x7d2c0000 0x80000000
ftp: setsockopt SO_DEBUG (ignored): Permission denied
---> EPSV
502 Command not implemented
disabling epsv4 for this connection
---> PASV
227 Entering Passive Mode (192,168,178,1,31,77)
---> STOR 0x7d2c0000 0x80000000
150 Opening BINARY data connection
100% |*************************************************************************************| 46300 KiB    5.43 MiB/s    00:00 ETA
226 Transfer complete
47411911 bytes sent in 00:37 (1.21 MiB/s)
---> QUIT
421 Service not available, remote server has closed connection.

done
helmut@freetz:/home/freetz-ng/freetz-ng-7690$
```

Ideen? Danke!

**Comment by SaMMy-lacht** [comment]
Da ich ja mit meinen Normalen ACC gesperrt bin. Da @fda77 ja keine Kritik abkann. Muss ich hier drüber schreiben.
Da die 7690 ein FIT Gerät ist. Benutze  -afu
`./push_firmware xxxxx.image -cmd ftp -afu`
danach warte ein wenig und dann gehe in deine AVM GUI und Update das gleiche image noch mal 
Und warum das ganze seit vielen Versionen von push, ist dieser Fehler drin. Daher erst temporärer das Image auf das FIT gerät bringen und dann erst richtig auf die Box übertragen.

**Reply by Helmut1972** [reply]
Hmmm, hab ich gemacht, ohne Erfolg.

```
helmut@freetz:/home/freetz-ng/freetz-ng-7690$ ./tools/push_firmware -cmd ftp -afu
[...]
helmut@freetz:/home/freetz-ng/freetz-ng-7690$
```

Reboot, Webinterface, erneut:

```
helmut@freetz:/home/freetz-ng/freetz-ng-7690$ ./tools/push_firmware -cmd ftp -afu
 * Analyzing 'images/7690_07.62.all_freetz-ng-24668M-2348ab24e7_20241016-170233.image' ...
 * Product: Fritz_Box_HW285 (FRITZ!Box 7690)
 * Using dos2unix binary: /usr/bin/dos2unix
 * Using tar binary: tools/tar-gnu
 * Using ftp binary: /usr/bin/tnftp
 * Target host: 192.168.178.1
 * Outgoing IP: 192.168.178.2
 * Flash mode: fit-boot
 * Allowed memory size: 1024 MB
 * Designated linux_fs_start: <other>

 !!! WARNING !!! WARNING !!! WARNING !!! WARNING !!! WARNING !!!
 !!!  THERE IS NO WARRANTY AT ALL !!! USE AT YOUR OWN RISK   !!!

 * Are you sure, that you want to flash this file to the device?
   images/7690_07.62.all_freetz-ng-24668M-2348ab24e7_20241016-170233.image
   Proceed? (y/[n]) y

 * You should now reboot your box (192.168.178.1). Waiting for shut down.
   Switch off, if reboot is not detected because it happens too quickly.
   Some newer bootloader versions allow to flash on power-cycle only.
   ................................................................
 * No reply from box, assuming switch-off or restart. Trying to re-detect box.
   Waiting ................................ found!

 * Reading 'env' file to /tmp/freetz_env_xC6
Connected to 192.168.178.1.
220 ADAM2 FTP Server ready
331 Password required for adam2
230 User adam2 successfully logged in
Remote system type is AVM.
Debugging on (debug=1).
---> TYPE I
200 Type set to BINARY
---> SYST
215 AVM EVA Version 1.12673 0x0 0x4C6409
---> MEDIA SDRAM
200 Media set to MEDIA_SDRAM
local: /tmp/freetz_env_xC6 remote: env
---> SIZE env
ftp: setsockopt SO_DEBUG (ignored)502 Command not implemented
: Permission denied
---> EPSV
502 Command not implemented
disabling epsv4 for this connection
---> PASV
227 Entering Passive Mode (192,168,178,1,26,16)
---> RETR env
150 Opening BINARY data connection
Timeout!!!!!!!!!!!!!!!!!!
   ProductID:            Fritz_Box_HW285
   HWRevision:           285
   HWSubRevision:        2
   memsize:              0x40000000
   linux_fs_start:       1

 * MAPSTART=0x40000000
 * FULLSIZE=0x40000000   (1024 MB)
 * MAPLIMIT=0x80000000
 * FILESIZE=0x02d372c7   (~45 MB)
 * ALIBYTES=0x00008d39   (~35 kB)
 * FREESIZE=0x3d2c0000   (~978 MB)
 * MTDSTART=0x7d2c0000

 * Box is back up again, initiating transfer.

Connected to 192.168.178.1.
220 ADAM2 FTP Server ready
331 Password required for adam2
230 User adam2 successfully logged in
Remote system type is AVM.
Debugging on (debug=1).
---> TYPE I
200 Type set to BINARY
---> MEDIA SDRAM
200 Media set to MEDIA_SDRAM
---> SETENV memsize 0x3d2c0000
200 SETENV command successful
---> SETENV kernel_args_tmp "mtdram1=0x7d2c0000,0x80000000 mtdparts_ext=update-image.0:0x2d372c7@0x0(fit-image)"
200 SETENV command successful
local: /tmp/freetz_s4E/fitboot.flash remote: 0x7d2c0000 0x80000000
ftp: setsockopt SO_DEBUG (ignored): Permission denied
---> EPSV
502 Command not implemented
disabling epsv4 for this connection
---> PASV
227 Entering Passive Mode (192,168,178,1,39,133)
---> STOR 0x7d2c0000 0x80000000
150 Opening BINARY data connection
100% |*************************************************************************************| 46300 KiB    5.45 MiB/s    00:00 ETA
226 Transfer complete
47411911 bytes sent in 00:37 (1.21 MiB/s)
---> QUIT
421 Service not available, remote server has closed connection.

done
helmut@freetz:/home/freetz-ng/freetz-ng-7690
```

Hab es beim zweiten mal auch nochmal mit

`./tools/push_firmware`

versucht, vergeblich.

**Comment by SaMMy-lacht** [comment]
Was habe ich gesagt
AVM GUI und Update das gleiche Image noch mal
Ich habe nichts von Pusch gesagt 

Das  -afu sagt ja das es im RAM ist und aus dem RAM geladen wird. Daher noch mal updaten per AVM GUI oder FREETZ-NG GUI. Und nicht pusch

**Comment by Helmut1972** [comment]
Hatte ich zuerst gemacht, "Die angegebene Datei enthält kein von AVM für dieses Gerät freigegebenes FRITZ!OS". Hatte ich nicht erwähnt, weil ich mir dacht "Weiss doch jeder dass das nicht geht".
Und ja, push mit -afu und dann Versuch des Uploads via AVM Web.

**Reply by SaMMy-lacht** [reply]
Wen so eine Meldung kommt `Die angegebene Datei enthält kein von AVM für dieses Gerät freigegebenes FRITZ!OS` wird das Image ja schon nicht mal auf deine Box übertragen. Und nicht aus dem RAM geladen.

**Comment by Helmut1972** [comment]
Sonst irgendein Weg, die Firmware drauf zu bekommen?

**Comment by Der-Jan** [comment]
Habe das gleiche Problem mit einer 5690Pro - egal ob mit oder ohne AFU - es scheint immer das installierte Image gestartet zu werden und nicht das Freetz Image, bzw. mir scheint die Box rebootet einfach, bevor der Vorgang abgeschlossen ist (das QUIT wird nicht mehr bestätigt - wenn man ncftp nutzt, kommt auch ein Timeout für das QUIT).

	   ProductID:            Fritz_Box_HW279
	   HWRevision:           279
	   HWSubRevision:        3
	   memsize:              0x80000000
	   linux_fs_start:       1

	 * MAPSTART=0x40000000
	 * FULLSIZE=0x80000000   (2048 MB)
	 * MAPLIMIT=0xc0000000
	 * FILESIZE=0x031d3ba3   (~49 MB)
	 * ALIBYTES=0x0000c45d   (~49 kB)
	 * FREESIZE=0x7ce20000   (~1998 MB)
	 * MTDSTART=0xbce20000

	 * Box is back up again, initiating transfer.

	Connected to 192.168.178.1.
	220 ADAM2 FTP Server ready
	331 Password required for adam2
	230 User adam2 successfully logged in
	Remote system type is AVM.
	Debugging on (debug=1).
	---> TYPE I
	200 Type set to BINARY
	---> MEDIA SDRAM
	200 Media set to MEDIA_SDRAM
	---> SETENV memsize 0x7ce20000
	200 SETENV command successful
	---> SETENV kernel_args_tmp "mtdram1=0xbce20000,0xc0000000 mtdparts_ext=update-image.0:0x31d3ba3@0x0(fit-image)"
	200 SETENV command successful
	local: /tmp/freetz_6aU/fitboot.flash remote: 0xbce20000 0xc0000000
	---> PASV
	227 Entering Passive Mode (192,168,178,1,30,163)
	---> STOR 0xbce20000 0xc0000000
	150 Opening BINARY data connection
	226 Transfer complete
	52247459 bytes sent in 2.06 secs (24.1723 MB/s)
	---> QUIT

**Comment by SaMMy-lacht** [comment]
Bezüglich der 5690Pro
https://github.com/Freetz-NG/freetz-ng/discussions/1023
Und für alle anderen
Aber bei den ganzen Änderungen bezüglich push, die man [hier](https://github.com/Freetz-NG/freetz-ng/commits/master/tools) ja sehen kann. Kann es bestimmt wieder mal passiert sein, dass es nicht mehr funktioniert. Teste doch mal eine alte Version.

**Comment by fda77** [comment]
@Der-Jan kannst du den ganzen Mittschnitt des AVM Recovery posten? Wird da jetzt 1 oder 2 GB verwendet?
Ich hab jedenfalls das alignen auch für "mtdparts_ext" hinzugefügt
PS: Da ich noch nie ein "fit-img" Gerät hatte (und mir zum herumspielen auch keins kaufen werde) ist das von meiner Seite aus lediglich THEORETISCH

**Reply by Der-Jan** [reply]
Hab gesehen, dass mit dem letzten Patch wieder auf 1GB RAM gehst - leider bleibt mein Problem...

Hier der Recovery Dump
1. Env lesen
2. Uptime lesen
3. NAND löschen
4. Image schreiben - allerdings mit Memsize 2GB minus Image Size; allerdings ist das Image etwas kleiner. Im Vergleich zum Fit Image aus dem Firmware Download, wird am Ende mit 0xFFFF auf 256 Byte aligned
```
   49  36.160127  172.16.0.65 → 172.16.0.1   UDP 58 56268 → 5035 Len=16
   50  36.597675  172.16.0.65 → 255.255.255.255 UDP 58 56268 → 5035 Len=16
   51  36.816606  172.16.0.65 → 172.16.0.1   UDP 58 56268 → 5035 Len=16
   52  37.038659   172.16.0.1 → 172.16.0.65  UDP 60 5035 → 5035 Len=16
   53  37.382095  172.16.0.65 → 172.16.0.1   TCP 66 50368 → 21 [SYN] Seq=0 Win=64240 Len=0 MSS=1460 WS=256 SACK_PERM
   56  37.387661   172.16.0.1 → 172.16.0.65  FTP 82 Response: 220 ADAM2 FTP Server ready
   57  37.387914  172.16.0.65 → 172.16.0.1   FTP 65 Request: USER adam2
   59  37.388060   172.16.0.1 → 172.16.0.65  FTP 87 Response: 331 Password required for adam2
   60  37.388223  172.16.0.65 → 172.16.0.1   FTP 65 Request: PASS adam2
   62  37.388373   172.16.0.1 → 172.16.0.65  FTP 93 Response: 230 User adam2 successfully logged in
   63  37.388525  172.16.0.65 → 172.16.0.1   FTP 59 Request: SYST
   65  37.388671   172.16.0.1 → 172.16.0.65  FTP 96 Response: 215 AVM EVA Version 1.12588 0x0 0x4C6409
   66  37.388842  172.16.0.65 → 172.16.0.1   FTP 61 Request: TYPE I
   68  37.388989   172.16.0.1 → 172.16.0.65  FTP 78 Response: 200 Type set to BINARY
   69  37.389132  172.16.0.65 → 172.16.0.1   FTP 66 Request: MEDIA SDRAM
   71  37.389272   172.16.0.1 → 172.16.0.65  FTP 84 Response: 200 Media set to MEDIA_SDRAM
   72  37.389413  172.16.0.65 → 172.16.0.1   FTP 59 Request: P@SW
   74  37.389558   172.16.0.1 → 172.16.0.65  FTP 101 Response: 227 Entering Passive Mode (172,16,0,1,17,147)
   75  37.390596  172.16.0.65 → 172.16.0.1   TCP 66 50369 → 4499 [SYN] Seq=0 Win=64240 Len=0 MSS=1460 WS=256 SACK_PERM
   78  37.394782  172.16.0.65 → 172.16.0.1   FTP 63 Request: RETR env
   80  37.394944   172.16.0.1 → 172.16.0.65  FTP 90 Response: 150 Opening BINARY data connection
   81  37.410637   172.16.0.1 → 172.16.0.65  FTP-DATA 1341 FTP Data: 1287 bytes (PASV) (RETR env)
   84  37.462673   172.16.0.1 → 172.16.0.65  FTP 77 Response: 226 Transfer complete
   89  37.567034  172.16.0.65 → 172.16.0.1   FTP 65 Request: USER adam2
   91  37.567166   172.16.0.1 → 172.16.0.65  FTP 87 Response: 331 Password required for adam2
   92  37.567232  172.16.0.65 → 172.16.0.1   FTP 65 Request: PASS adam2
   94  37.567357   172.16.0.1 → 172.16.0.65  FTP 93 Response: 230 User adam2 successfully logged in
   95  37.567414  172.16.0.65 → 172.16.0.1   FTP 59 Request: SYST
   97  37.567545   172.16.0.1 → 172.16.0.65  FTP 96 Response: 215 AVM EVA Version 1.12588 0x0 0x4C6409
   98  37.567604  172.16.0.65 → 172.16.0.1   FTP 61 Request: TYPE I
  100  37.567728   172.16.0.1 → 172.16.0.65  FTP 78 Response: 200 Type set to BINARY
  101  37.567784  172.16.0.65 → 172.16.0.1   FTP 66 Request: MEDIA SDRAM
  103  37.567912   172.16.0.1 → 172.16.0.65  FTP 84 Response: 200 Media set to MEDIA_SDRAM
  104  37.567972  172.16.0.65 → 172.16.0.1   FTP 59 Request: P@SW
  106  37.568101   172.16.0.1 → 172.16.0.65  FTP 100 Response: 227 Entering Passive Mode (172,16,0,1,18,70)
  107  37.568589  172.16.0.65 → 172.16.0.1   TCP 66 50370 → 4678 [SYN] Seq=0 Win=64240 Len=0 MSS=1460 WS=256 SACK_PERM
  110  37.582234  172.16.0.65 → 172.16.0.1   FTP 65 Request: RETR count
  112  37.582363   172.16.0.1 → 172.16.0.65  FTP 90 Response: 150 Opening BINARY data connection
  113  37.587646   172.16.0.1 → 172.16.0.65  FTP-DATA 205 FTP Data: 151 bytes (PASV) (RETR count)
  116  37.629404   172.16.0.1 → 172.16.0.65  FTP 77 Response: 226 Transfer complete
  121  37.739613  172.16.0.65 → 172.16.0.1   FTP 58 Request: BYE
  123  37.739794   172.16.0.1 → 172.16.0.65  FTP 118 Response: 221 Thank you for using the FTP service on ADAM2
  128  38.509075  172.16.0.65 → 172.16.0.1   TCP 66 50377 → 21 [SYN] Seq=0 Win=64240 Len=0 MSS=1460 WS=256 SACK_PERM
  131  38.514678   172.16.0.1 → 172.16.0.65  FTP 82 Response: 220 ADAM2 FTP Server ready
  132  38.520567  172.16.0.65 → 172.16.0.1   FTP 65 Request: USER adam2
  134  38.520726   172.16.0.1 → 172.16.0.65  FTP 87 Response: 331 Password required for adam2
  135  38.520916  172.16.0.65 → 172.16.0.1   FTP 65 Request: PASS adam2
  137  38.521058   172.16.0.1 → 172.16.0.65  FTP 93 Response: 230 User adam2 successfully logged in
  138  38.521213  172.16.0.65 → 172.16.0.1   FTP 59 Request: SYST
  140  38.521356   172.16.0.1 → 172.16.0.65  FTP 96 Response: 215 AVM EVA Version 1.12588 0x0 0x4C6409
  141  38.521510  172.16.0.65 → 172.16.0.1   FTP 61 Request: TYPE I
  143  38.521647   172.16.0.1 → 172.16.0.65  FTP 78 Response: 200 Type set to BINARY
  144  38.521785  172.16.0.65 → 172.16.0.1   FTP 65 Request: MEDIA FLSH
  146  38.521921   172.16.0.1 → 172.16.0.65  FTP 84 Response: 200 Media set to MEDIA_FLASH
  147  38.522059  172.16.0.65 → 172.16.0.1   FTP 59 Request: P@SW
  149  38.522201   172.16.0.1 → 172.16.0.65  FTP 99 Response: 227 Entering Passive Mode (172,16,0,1,22,0)
  150  38.523250  172.16.0.65 → 172.16.0.1   TCP 66 50378 → 5632 [SYN] Seq=0 Win=64240 Len=0 MSS=1460 WS=256 SACK_PERM
  153  38.536058  172.16.0.65 → 172.16.0.1   FTP 67 Request: STOR mtdnand
  155  39.354542   172.16.0.1 → 172.16.0.65  FTP 90 Response: 150 Opening BINARY data connection
  157  39.473972  172.16.0.65 → 172.16.0.1   FTP-DATA 2070 FTP Data: 2016 bytes (PASV) (STOR mtdnand)
  158  39.489491  172.16.0.65 → 172.16.0.1   TCP 1494 [TCP Retransmission] 50378 → 5632 [PSH, ACK] Seq=577 Ack=1 Win=64240 Len=1440
  164  40.208811   172.16.0.1 → 172.16.0.65  FTP 77 Response: 226 Transfer complete
  166  40.333324  172.16.0.65 → 172.16.0.1   FTP 58 Request: BYE
  168  40.333467   172.16.0.1 → 172.16.0.65  FTP 118 Response: 221 Thank you for using the FTP service on ADAM2
  173  40.584125  172.16.0.65 → 172.16.0.1   TCP 66 50379 → 49000 [SYN] Seq=0 Win=64240 Len=0 MSS=1460 WS=256 SACK_PERM
  174  41.599069  172.16.0.65 → 172.16.0.1   TCP 66 [TCP Retransmission] 50379 → 49000 [SYN] Seq=0 Win=64240 Len=0 MSS=1460 WS=256 SACK_PERM
  177  42.521472  172.16.0.65 → 172.16.0.1   TCP 66 [TCP Port numbers reused] 50379 → 49000 [SYN] Seq=0 Win=64240 Len=0 MSS=1460 WS=256 SACK_PERM
  179  42.540808  172.16.0.65 → 172.16.0.1   TCP 66 50380 → 21 [SYN] Seq=0 Win=64240 Len=0 MSS=1460 WS=256 SACK_PERM
  182  42.546727   172.16.0.1 → 172.16.0.65  FTP 82 Response: 220 ADAM2 FTP Server ready
  183  42.547115  172.16.0.65 → 172.16.0.1   FTP 65 Request: USER adam2
  185  42.547285   172.16.0.1 → 172.16.0.65  FTP 87 Response: 331 Password required for adam2
  186  42.547552  172.16.0.65 → 172.16.0.1   FTP 65 Request: PASS adam2
  188  42.547720   172.16.0.1 → 172.16.0.65  FTP 93 Response: 230 User adam2 successfully logged in
  189  42.548197  172.16.0.65 → 172.16.0.1   FTP 59 Request: SYST
  191  42.548359   172.16.0.1 → 172.16.0.65  FTP 96 Response: 215 AVM EVA Version 1.12588 0x0 0x4C6409
  192  42.548615  172.16.0.65 → 172.16.0.1   FTP 61 Request: TYPE I
  194  42.548778   172.16.0.1 → 172.16.0.65  FTP 78 Response: 200 Type set to BINARY
  195  42.549023  172.16.0.65 → 172.16.0.1   FTP 66 Request: MEDIA SDRAM
  197  42.549188   172.16.0.1 → 172.16.0.65  FTP 84 Response: 200 Media set to MEDIA_SDRAM
  198  42.549427  172.16.0.65 → 172.16.0.1   FTP 59 Request: P@SW
  200  42.549600   172.16.0.1 → 172.16.0.65  FTP 101 Response: 227 Entering Passive Mode (172,16,0,1,37,187)
  201  42.551352  172.16.0.65 → 172.16.0.1   TCP 66 50381 → 9659 [SYN] Seq=0 Win=64240 Len=0 MSS=1460 WS=256 SACK_PERM
  204  42.552800  172.16.0.65 → 172.16.0.1   FTP 63 Request: RETR env
  206  42.552985   172.16.0.1 → 172.16.0.65  FTP 90 Response: 150 Opening BINARY data connection
  207  42.566530   172.16.0.1 → 172.16.0.65  FTP-DATA 1217 FTP Data: 1163 bytes (PASV) (RETR env)
  210  42.628705   172.16.0.1 → 172.16.0.65  FTP 77 Response: 226 Transfer complete
  215  42.741236  172.16.0.65 → 172.16.0.1   FTP 58 Request: BYE
  217  42.741417   172.16.0.1 → 172.16.0.65  FTP 118 Response: 221 Thank you for using the FTP service on ADAM2
  222  42.866990  172.16.0.65 → 172.16.0.1   TCP 66 50382 → 21 [SYN] Seq=0 Win=64240 Len=0 MSS=1460 WS=256 SACK_PERM
  225  42.872713   172.16.0.1 → 172.16.0.65  FTP 82 Response: 220 ADAM2 FTP Server ready
  226  42.880853  172.16.0.65 → 172.16.0.1   FTP 65 Request: USER adam2
  228  42.880998   172.16.0.1 → 172.16.0.65  FTP 87 Response: 331 Password required for adam2
  229  42.881135  172.16.0.65 → 172.16.0.1   FTP 65 Request: PASS adam2
  231  42.881272   172.16.0.1 → 172.16.0.65  FTP 93 Response: 230 User adam2 successfully logged in
  232  42.881388  172.16.0.65 → 172.16.0.1   FTP 59 Request: SYST
  234  42.881529   172.16.0.1 → 172.16.0.65  FTP 96 Response: 215 AVM EVA Version 1.12588 0x0 0x4C6409
  235  42.881654  172.16.0.65 → 172.16.0.1   FTP 80 Request: SETENV memsize 0x7ce90000
  237  42.882930   172.16.0.1 → 172.16.0.65  FTP 85 Response: 200 SETENV command successful
  238  42.883047  172.16.0.65 → 172.16.0.1   FTP 175 Request: SETENV kernel_args_tmp "avm_fwupdate mtdram1=0x7ce90000,0x80000000 mtdparts_ext=update-image.0:0x3170000@0x0(fit-image)"
  240  42.883267   172.16.0.1 → 172.16.0.65  FTP 85 Response: 200 SETENV command successful
  241  42.883380  172.16.0.65 → 172.16.0.1   FTP 61 Request: TYPE I
  243  42.883515   172.16.0.1 → 172.16.0.65  FTP 78 Response: 200 Type set to BINARY
  244  42.883626  172.16.0.65 → 172.16.0.1   FTP 66 Request: MEDIA SDRAM
  246  42.883764   172.16.0.1 → 172.16.0.65  FTP 84 Response: 200 Media set to MEDIA_SDRAM
  247  42.883881  172.16.0.65 → 172.16.0.1   FTP 59 Request: P@SW
  249  42.884027   172.16.0.1 → 172.16.0.65  FTP 100 Response: 227 Entering Passive Mode (172,16,0,1,39,10)
  250  42.884866  172.16.0.65 → 172.16.0.1   TCP 66 50383 → 9994 [SYN] Seq=0 Win=64240 Len=0 MSS=1460 WS=256 SACK_PERM
  253  42.896529  172.16.0.65 → 172.16.0.1   FTP 81 Request: STOR 0x7ce90000 0x80000000
  255  42.896745   172.16.0.1 → 172.16.0.65  FTP 90 Response: 150 Opening BINARY data connection
  256  42.912104  172.16.0.65 → 172.16.0.1   FTP-DATA 14454 FTP Data: 14400 bytes (PASV) (STOR 0x7ce90000 0x80000000)
  258  42.917833  172.16.0.65 → 172.16.0.1   FTP-DATA 25974 FTP Data: 25920 bytes (PASV) (STOR 0x7ce90000 0x80000000)
  260  42.919299  172.16.0.65 → 172.16.0.1   FTP-DATA 25270 FTP Data: 25216 bytes (PASV) (STOR 0x7ce90000 0x80000000)
```

**Reply by SaMMy-lacht** [reply]
@Der-Jan 
Nur für dich habe ich nun noch mal die 5690Pro mit einem freetz-ng Image per push aus dem Jahr 2023 gefreetzt.
[5690Pro.webm](https://github.com/user-attachments/assets/88934528-147c-4e7e-9964-a11e4acbe26b)
Auch wenn ich wieder gesperrt werde von @fda77. Ist es mir egal, da ich ja weiß, wo die Fehler zu suchen sind! 

Jetzt ist das Original Image wieder auf der Box.

**Comment by fda77** [comment]
@SaMMy-lacht: einfach an der 1. Gebot halten

> §1 geh mir nicht auf den Sack

**Comment by fda77** [comment]
Weshalb die IP 172,16,0,1? Normal ist ein anderer IP Bereich wenn man nicht mit Broadcasts sucht. Wie hast du das gemacht? Wird da geroutet oder Wlan genutzt

> Hab gesehen, dass mit dem letzten Patch wieder auf 1GB RAM gehst

>  allerdings mit Memsize 2GB minus Image Size; allerdings ist das Image etwas kleiner.

Ich hab es so verstanden als ob avm das auch so macht... ich änder es wieder


> 3 NAND löschen

Um genau zu sein wird da eine fast leere config geflasht in die defaults vom Gelesenem aus 1) und 2) eingebaut sind. Das gibts in pushfirmware nicht



> wird am Ende mit 0xFFFF auf 256 Byte aligned

Ich find es jetzt nicht mehr (war das ein anderer Thread?), aber hattest du nicht 64 geschrieben? Auffüllen ist in PF auch nicht drin

**Reply by fda77** [reply]
Bei ram-boot wurde auf 256bytes aufgefüllt, allerdings wurden da auch kernel + filesystem aneinander gehängt, und so begann das filesystem ausgrtichtet. Evtl sind das einfach Überreste bei AVM

**Reply by Der-Jan** [reply]
> Weshalb die IP 172,16,0,1? Normal ist ein anderer IP Bereich wenn man nicht mit Broadcasts sucht. Wie hast du das gemacht? Wird da geroutet oder Wlan genutzt

Das ist die IP meiner Fritz Box - hab ich schon seit Jahrzehnten so (und war immer zu faul alle Geräte auf etwas anderes umzustellen). Das AVM Recovery Tool nutzt ja den Broadcast auf Port 5035, um EVA die IP mitzuteilen. Seitdem ich das weiss, nutze ich immer eva_discover. Gefühlt funktioniert das zuverlässiger - sprich bei fast jedem Cold Boot - verglichen mit ping an 192.168.178.1 - das funktioniert nur bei jedem 2.-3. Versuch.

**Reply by fda77** [reply]
Den Mechanismus kenne ich, der ist prima! Den müsste nur noch jemand in push firmware einbauen... Die ganzen Script von PP sind nur für Windows/Powershell?
Das mit den Broadcasts ist jedenfalls viel besser, weil die Box den beim Booten sendet und darauf reagiert werden kann - statt (wie PF) irgend wie zu warten und immer zu schauen wann die Box ansprechbar ist. Auch werden dann nicht falsche Gerät angesprochen, zb wenn Fritzos die gleiche IP hat

**Comment by fda77** [comment]
Jetzt auch auf 256bytes mit 0xFF gefüllt: 6fcfa4367
Ich glaub zwar nicht dass das viel ausmacht, aber es soll ja wie AVM sein

**Reply by Helmut1972** [reply]
Falls Du da noch auf Feedback warten solltest: Nein hat nicht geholfen. Auch ein "-ram 0" nicht.

Was mich halt stutzig macht ist der 421 zum Schluss, das sollte doch sicher nicht so sein.

```
226 Transfer complete
47411968 bytes sent in 00:37 (1.21 MiB/s)
---> QUIT
421 Service not available, remote server has closed connection.
```

**Reply by fda77** [reply]
Nach dem "quit" macht der Server wohl die Verbindung zu

**Reply by Helmut1972** [reply]
Nein, das klingt eher nach unkontrolliert / Absturz. Korrekt wäre sowas:

```
150 Opening BINARY data connection
226 Transfer complete
38312192 bytes sent in 7.64 secs (4.7797 MB/s)
---> SETENV linux_fs_start 1
200 SETENV command successful
---> QUIT
221 Thank you for using the FTP service on ADAM2
```

Siehe auch https://github.com/Freetz-NG/freetz-ng/discussions/1053#discussioncomment-10991290:

`mir scheint die Box rebootet einfach, bevor der Vorgang abgeschlossen ist (das QUIT wird nicht mehr bestätigt - wenn man ncftp nutzt, kommt auch ein Timeout für das QUIT).`
