### DISCUSSION TITLE
Juis für Geräte ab HWR277, aber auch 265

### DISCUSSION THREAD

**Discussion by fda77** [Freetz-NG/freetz-ng#1415] [Offene Probleme]
Das aktuelle Juis-Script findest ab HWR277 keine Firmware mehr, etwa diese Geräte:

```
FRITZ!Smart Gateway | 265

FRITZ!Box 6860 5G | 277
FRITZ!Box 7530 AX | 278
FRITZ!Box 5690 Pro | 279
FRITZ!Box 6670 Cable | 284
FRITZ!Box 7690 | 285
FRITZ!Box 7682 | 286
FRITZ!Box 4050 | 287
FRITZ!Repeater 1700 | 290
FRITZ!Box 4690 | 291
FRITZ!Box 5690 XGS | 295
FRITZ!Repeater 1200 AX v2 | 296
FRITZ!Box 6850 4G | 297
FRITZ!Box 5690 | 298
FRITZ!Repeater 2700 | 301
FRITZ!Box 7632 | 303
FRITZ!Repeater 1610 Outdoor | 305
FRITZ!Box 6825 4G | 306
FRITZ!Box 4630 | 307
FRITZ!Box 6690 Pro | 308
...
```

Vermutlich hat AVM etwas an der Abfrage verändert, es fehlt vielleicht eine Variable, etc.
Dazu müsste jemand der so eine neue Fritzbox hat diese Abfrage mit tcpdump mitschneiden.
Man kann die Fritzbox dazu auch als Client im LAN konfigurieren ("Internet mitbenutzen").
So ein Mitschnitt solle schon ausreichen

**Comment by LizenzFass78851** [comment]
Bezüglich Juis habe ich noch eine andere Endeckung gemacht.
Ich habe mit einer 7530 AX (v1) mit FOS Version 8.00 immer nach Updates gesucht.
Direkt ohne Reverse Proxy dazwischen, wird das Firmware Update auf 8.20 erkannt, lässt sich aber als Mitschnitt nicht auswerten da der Traffic verschlüsselt ist.
Mit Reverse Proxy (Siehe https://github.com/orgs/Freetz-NG/discussions/1179#discussioncomment-13552272), konnte ich den Traffic unverschlüsselt mitschneiden, dafür wird mir kein Firmware Update erkannt.

Bin mir nicht sicher ob bei den FritzBoxen (warscheinlich alle mit Firmware ab 8.00) per HTTPs etwas übermittelt oder erkannt wird was per HTTP (über Reverse Proxy) oder auch per [juis_check Tool](https://github.com/Freetz-NG/freetz-ng/blob/master/tools/juis_check) nicht funktioniert.

----

Dazu ist mir auch aufgefallen das wenn ich für die besagte 7530 AX (v1) mit den juis_check Tool mit der angegebene Version bis maximal 7.50 nach Updates suche, auch damit ein Update erkannt wird, aber sobald man als Version 8.00 mindestens angibt, wird wiederum kein Update angezeigt.

juis_check benutzt zwar auch https aber ich vermute das mit den "Vermutlich hat AVM etwas an der Abfrage verändert" könnte auf alle Boxen ab FW Version 8.00 zutreffen.

**Reply by LizenzFass78851** [reply]
Laut https://www.ip-phone-forum.de/threads/update-check-%C3%BCber-den-neuen-avm-service.287657/post-2583732 bestätigt das meine Vermutung das FritzBoxen (**nicht** nur die neusten FritzBoxen ab HWR277 und 265) bei der juis Prüfung nur noch HTTPS verwendet.
Daher ist ein Paketmitschnitt nicht auswertbar weil wie [erwähnt](https://github.com/orgs/Freetz-NG/discussions/1415#discussioncomment-15925862) der Traffic verschlüsselt ist.

**Reply by fda77** [reply]
ich antworte lieber ganz unten...

**Comment by fda77** [comment]
Soweit mit bekannt ist nutzt avm immer HTTP, wobei das script hier per default HTTPS nutzt - das ging aber.
Dh falls avm Verschlüsselt aktiviert hat sollte das kein Problem sein.

Wobei bei HTTP als Hostname <HWR>.jws.avm.de genutzt wird, HTTPS kann diese nicht nutzen da es kein korrekter Zertifikat das zum Hostnamen passt gibt. Daher wird für HTTPS "jws.avm.de" verwendet.

Welchen Hostnamen hast du denn im Mittschnitt gesehen?

Laut https://freetz-ng.github.io/freetz-ng/juis/ gibt es aber keine Änderung bezüglich FOS 8, sogar die aktuellen inhaus+labor werden von alten Geräten gefunden

Ich tipper daher auf Änderungen  am body den man damit sieht:
```
juis_check        Version=113.07.60       Provider=tonline               HW=185  OEM=avm Lang=de Country=049     -d
```


EDIT:
die 7.62 scheint nicht mehr telekom-exklusiv zu sein, es geht mittlerweile auch so:
```
juis_check        Version=113.07.60                   HW=185      -d
```

Wobei diese Abfrage 07.12 ergibt:
```
juis_check                  HW=185      -d
```

**Reply by LizenzFass78851** [reply]
> Welchen Hostnamen hast du denn im Mittschnitt gesehen?

`jws.avm.de`

**Reply by LizenzFass78851** [reply]
> Laut https://freetz-ng.github.io/freetz-ng/juis/ gibt es aber keine Änderung bezüglich FOS 8, sogar die aktuellen inhaus+labor werden von alten Geräten gefunden

Das Funktioniert auch.
Mir ist nur dazu aufgefallen (wie in meinen [comment](https://github.com/orgs/Freetz-NG/discussions/1415#discussioncomment-15925862) grob beschrieben) das wenn man als Version mindestens 8.00 verwendet
`juis_check        Version=256.08.00                   HW=256      -d`
Das da kein Update angezeigt wird.

Verwendet man stattdessen 
`juis_check        Version=256.07.50                   HW=256      -d`
oder sogar ohne Angabe von `Version`, wird ein Update gefunden.

**Comment by fda77** [comment]
Ohne Version wird genommen:
```
<q:HW>256</q:HW>
<q:Major>256</q:Major>
<q:Minor>0</q:Minor>
<q:Patch>00</q:Patch>
<q:Buildnumber>00000</q:Buildnumber>
```

Wenn man einen Parameter weglässt versucht das Script diesen evtl zu erraten.
Man weisst halt nicht welche Logik AVM hinter Juis hat!

Von den min 5 Juis-Servern die es gibt, geben diese auch noch verschiedene Antworten

**Comment by fda77** [comment]
Juis sagt dir auch manchmal was nicht passt:
```
./juis_check     --https    Version=277.08.19.12345                    HW=277      -d

    <soap:Fault>
      <faultcode>soap:Server</faultcode>
      <faultstring>cvc-pattern-valid: Value '8.19' is not facet-valid with respect to pattern '[0-9]{1,3}' for type '#AnonType_MinorBoxInfo'.</faultstring>
```

**Comment by fda77** [comment]
juis_check kann man mit freetz auch ins image packen, auf der box wird dann "juis_boxinfo.xml or older jason_boxinfo.xml" verwendet.
Schau doch mal was in dieser Datei alles steht!
Evtl wird noch ein "--https         Forces to use https. Curl is mandatory for https." als Parameter zu "on fritzbox only if "FREETZ_ADD_JUIS_CHECK__SSL"" benötigt.

**Reply by LizenzFass78851** [reply]
> Schau doch mal was in dieser Datei alles steht! 

- `juis_boxinfo.xml`

```xml
<e:BoxInfo xmlns:e="http://juis.avm.de/updateinfo" xmlns:q="http://juis.avm.de/request">
<q:Name>FRITZ!Box 7530 AX (UI)</q:Name>
<q:HW>256</q:HW>
<q:Major>256</q:Major>
<q:Minor>8</q:Minor>
<q:Patch>00</q:Patch>
<q:Buildnumber>116010</q:Buildnumber>
<q:Buildtype>1</q:Buildtype>
<q:Serial>B0F2********</q:Serial>
<q:OEM>1und1</q:OEM>
<q:Lang>de</q:Lang>
<q:Country>049</q:Country>
<q:Annex>B</q:Annex>
<q:Flag>crashreport</q:Flag>
<q:Flag>prov_acs</q:Flag>
<q:Flag>avm_acs</q:Flag>
<q:Flag>medium_lan</q:Flag>
<q:Flag>mesh_repeater</q:Flag>
<q:UpdateConfig>3</q:UpdateConfig>
<q:Provider>oma_ipclient</q:Provider>
<q:ProviderName/>
</e:BoxInfo>
```

**Comment by fda77** [comment]
Ich hab es probiert mit 
```
env - tools/juis_check       Version=256.08.00-116010 Name=FRITZ\!Box 7530 AX           HW=256         OEM=1und1 Lang=de Country=049 Buildtype=1 Annex=B UpdateConfig=3 Provider=oma_ipclient ProviderName=empty  ManualRequest=false  Flag=myfritz_letsencrypt Flag=mesh_master_no_trusted   -i -s -d

```

Was in dieser Abfrage resultierte:
```xml
<soap:Envelope xmlns:soap="http://schemas.xmlsoap.org/soap/envelope/" xmlns:soap-enc="http://schemas.xmlsoap.org/soap/encoding/" xmlns:xsi="http://www.w3.org/2001/XMLSchema-instance" xmlns:xsd="http://www.w3.org/2001/XMLSchema" xmlns:e="http://juis.avm.de/updateinfo" xmlns:q="http://juis.avm.de/request">
<soap:Header/>
<soap:Body>
<e:BoxFirmwareUpdateCheck>
<e:RequestHeader>
<q:Nonce>QU0z18PEJNOpHzsmbL04Xg==</q:Nonce>
<q:UserAgent>TestClient</q:UserAgent>
<q:ManualRequest>false</q:ManualRequest></e:RequestHeader>
<e:BoxInfo>
<q:Name>FRITZ!Box 7530 AX</q:Name>
<q:HW>256</q:HW>
<q:Major>256</q:Major>
<q:Minor>8</q:Minor>
<q:Patch>00</q:Patch>
<q:Buildnumber>116010</q:Buildnumber>
<q:Buildtype>1</q:Buildtype>
<q:Serial>AC6CBABEED2C</q:Serial>
<q:OEM>1und1</q:OEM>
<q:Lang>de</q:Lang>
<q:Country>049</q:Country>
<q:Annex>B</q:Annex>
<q:Flag>mesh_master_no_trusted</q:Flag>
<q:UpdateConfig>3</q:UpdateConfig>
<q:Provider>oma_ipclient</q:Provider></e:BoxInfo></e:BoxFirmwareUpdateCheck></soap:Body></soap:Envelope>

```
was keine neue Version bekam.

Damit müsste eher am Header was geändert sein

```xml
<e:BoxFirmwareUpdateCheck>
<e:RequestHeader>
<q:Nonce>QU0z18PEJNOpHzsmbL04Xg==</q:Nonce>
<q:UserAgent>TestClient</q:UserAgent>
<q:ManualRequest>false</q:ManualRequest></e:RequestHeader>
```


Dafür braucht man dann eine capture, da tcpdump nicht geht halt mit strace oder einer proxy bin/lib

**Reply by LizenzFass78851** [reply]
Beim Thema HTTP Proxy, bin ich mir nicht sicher ob und wie das funktioniert.
Bei z.b. libproxy ist nur eine libary was von programmen verwendet werden kann, Es scheint keine libary zu sein um jedlichen internet Traffic durch einen Proxy umzuleiten, zu erzwingen.

-----

Und was mir noch aufgefallen ist.
Ich habe da bei der 7530AX (v1) die Freetz Firmware mit der Version 8.00 installiert und habe das mit den juis über die AVM WebUI getestet und habe festgestellt, sobald es ein neues Update gefunden hat, wird es im Hintergrund installiert und nach einen manuellen neustart oder beim aus und einstecken des Stromsteckers, wechselt es nur noch den Slot und damit ist wieder die OriginalFirmware 8.20 drauf und nicht mehr die bisher installierte Freetz Firmware 8.00

**Reply by LizenzFass78851** [reply]
> Und was mir noch aufgefallen ist.

Bezüglich Silent Update, stimmt wirklich laut `/var/updatecheck.log`

**Edit:** Die installation ebenfalls

```
2026-03-01 13:34:41 AutoCheck: scheduled to happen at 2026-03-01 13:36:01
2026-03-01 13:34:49 ManualCheck: Get mesh master box info complete req_id=0, box info unknown
2026-03-01 13:34:49 ManualCheck: request with id 1234 issued
2026-03-01 13:34:50 ManualCheck: request 1234 complete: update found, CheckInterval=48, DownloadURL='http://download.avm.de/fritzbox/fritzbox-7530-ax/deutschland/fritz.os/FRITZ.Box_7530_AX-08.20.image', Priority=1
2026-03-01 13:34:50 AutoUpdate: scheduled to happen at 02.03.2026 0:42:40
2026-03-01 13:34:50 AutoUpdate: download for silent update scheduled to happen at 01.03.2026 13:38:11
2026-03-01 13:38:11 AutoUpdate: now (pre-)downloading image and flashing (but no reboot ("update") yet)
2026-03-01 13:38:11 Update: method=silent download_url=http://download.avm.de/fritzbox/fritzbox-7530-ax/deutschland/fritz.os/FRITZ.Box_7530_AX-08.20.image
2026-03-01 13:38:42 AutoUpdate: predownloading and flashing image for silent update succeeded
```

**Reply by fda77** [reply]
Nebenbei, es gibt übrigens https://freetz-ng.github.io/freetz-ng/patches/#remove-pubkey damit so ein update nicht geprüft werden kann...

**Comment by LizenzFass78851** [comment]
Ich habe nochmal versucht wege zu finden wie man diesen Capture in "Sichtbar" hinbekommt.
Dabei habe ich wie [dort](https://github.com/orgs/Freetz-NG/discussions/1179#discussioncomment-13552272) erklärt das ich die 7530AX hinter einen Vorgeschalteten Router gesteckt habe und als DNS Server für die AX und den Vorgeschalteten Router auf meinen Lokalen Test DNS Server gelegt, um als DNS antwort mit der IP Adresse von `jws.avm.de` gegen den des Test ReverseProxys mit nginx auszutauschen.
Wie bereits [erwähnt](https://github.com/orgs/Freetz-NG/discussions/1415#discussioncomment-15925862) führte das dazu das das Capture möglich war aber es keinen Update gefunden hat.

Nun habe ich das gleiche probiert aber mit den ReverseProxy mit HTTPs und einen eigenen Cert was ich auch auf die Box kopiert habe.
Ohne die SSL Cliper einzuschränken läuft die Verbindung per TLSv1.3 sowohl durch den ReverseProxy als auch von den ReverseProxy zum jws.avm.de Server.
Dann habe ich den ReverseProxy den Cliper auf TLSv1.2 ohne ECDHE geändert und das führte dazu das man zwar nun mit den eigenen Private Key den Capture auslesen kann aber wieder trotz HTTPs kein neues gefundenes Update.

Deutlich einfacher ist es gewesen bei der Freetzfirmware nur das `avm_root_ca.pem` mit `nanox` oder `vix` ungeändert einmal beschreiben und es durch irgend ein anderes CA zu ersetzen. Dann macht es ebenfalls ein fallback auf http.

-----

@fda77 

> Damit müsste eher am Header was geändert sein

Einziges was mir mit den was ich bisher versucht habe herauszufinden ist:

```xml
<e:BoxFirmwareUpdateCheck>
<e:RequestHeader>
<q:Nonce>LMkr671Ey2xgw4rFPSTBSw==</q:Nonce>
<q:UserAgent>Box</q:UserAgent>
<q:ManualRequest>true</q:ManualRequest>
```

-----

# Inhalte:

<details>
  <summary>Wireshark Output</summary>

- Paketmitschnitt

```
39	11.646395	192.168.188.1	192.168.178.10	TCP	60	36339 → 443 [SYN] Seq=0 Win=64240 Len=0 MSS=1460 SACK_PERM=1 TSval=2610664058 TSecr=0 WS=64
40	11.656287	192.168.178.10	192.168.188.1	TCP	60	443 → 36339 [SYN, ACK] Seq=0 Ack=1 Win=65160 Len=0 MSS=1460 SACK_PERM=1 TSval=1722783535 TSecr=2610664058 WS=128
41	11.656663	192.168.188.1	192.168.178.10	TCP	52	36339 → 443 [ACK] Seq=1 Ack=1 Win=64256 Len=0 TSval=2610664068 TSecr=1722783535
42	11.658161	192.168.188.1	192.168.178.10	TLSv1.2	569	Client Hello
43	11.664286	192.168.178.10	192.168.188.1	TCP	52	443 → 36339 [ACK] Seq=1 Ack=518 Win=64768 Len=0 TSval=1722783544 TSecr=2610664069
44	11.665018	192.168.178.10	192.168.188.1	TLSv1.2	1437	Server Hello, Certificate, Server Hello Done
45	11.665217	192.168.188.1	192.168.178.10	TCP	52	36339 → 443 [ACK] Seq=518 Ack=1386 Win=64128 Len=0 TSval=2610664077 TSecr=1722783545
46	11.672002	192.168.188.1	192.168.178.10	TLSv1.2	626	Client Key Exchange, Change Cipher Spec, Finished
47	11.722800	192.168.178.10	192.168.188.1	TCP	52	443 → 36339 [ACK] Seq=1386 Ack=1092 Win=64256 Len=0 TSval=1722783599 TSecr=2610664083
48	11.765015	192.168.178.10	192.168.188.1	TLSv1.2	310	New Session Ticket, Change Cipher Spec, Finished
49	11.766940	192.168.188.1	192.168.178.10	TLSv1.2	1105	[TLS segment of a reassembled PDU]
50	11.772596	192.168.178.10	192.168.188.1	TCP	52	443 → 36339 [ACK] Seq=1644 Ack=2145 Win=63232 Len=0 TSval=1722783652 TSecr=2610664178
51	11.772812	192.168.188.1	192.168.178.10	HTTP/XML	341	POST /Jason/UpdateInfoService HTTP/1.1 
52	11.778333	192.168.178.10	192.168.188.1	TCP	52	443 → 36339 [ACK] Seq=1644 Ack=2434 Win=62976 Len=0 TSval=1722783658 TSecr=2610664184
53	11.861216	192.168.178.10	192.168.188.1	TCP	1500	443 → 36339 [ACK] Seq=1644 Ack=2434 Win=62976 Len=1448 TSval=1722783740 TSecr=2610664184 [TCP segment of a reassembled PDU]
54	11.861566	192.168.178.10	192.168.188.1	HTTP/XML	682	HTTP/1.1 200 OK 
55	11.861765	192.168.188.1	192.168.178.10	TCP	52	36339 → 443 [ACK] Seq=2434 Ack=3722 Win=64128 Len=0 TSval=2610664273 TSecr=1722783740
56	11.867248	192.168.188.1	192.168.178.10	TCP	52	36339 → 443 [FIN, ACK] Seq=2434 Ack=3722 Win=64128 Len=0 TSval=2610664279 TSecr=1722783740
57	11.873754	192.168.178.10	192.168.188.1	TCP	52	443 → 36339 [FIN, ACK] Seq=3722 Ack=2435 Win=62976 Len=0 TSval=1722783753 TSecr=2610664279
58	11.874107	192.168.188.1	192.168.178.10	TCP	52	36339 → 443 [ACK] Seq=2435 Ack=3723 Win=64128 Len=0 TSval=2610664285 TSecr=1722783753
```

- TCP Stream der juis-Anfrage

```
POST /Jason/UpdateInfoService HTTP/1.1
Host: jws.avm.de:443
Content-Length: 1157
Content-Type: text/xml; charset="utf-8"


<soap:Envelope xmlns:soap="http://schemas.xmlsoap.org/soap/envelope/" xmlns:soap-enc="http://schemas.xmlsoap.org/soap/encoding/" xmlns:xsi="http://www.w3.org/2001/XMLSchema-instance" xmlns:xsd="http://www.w3.org/2001/XMLSchema" xmlns:e="http://juis.avm.de/updateinfo" xmlns:q="http://juis.avm.de/request">
<soap:Header/>
<soap:Body>
<e:BoxFirmwareUpdateCheck>
<e:RequestHeader>
<q:Nonce>LMkr671Ey2xgw4rFPSTBSw==</q:Nonce>
<q:UserAgent>Box</q:UserAgent>
<q:ManualRequest>true</q:ManualRequest></e:RequestHeader>
<e:BoxInfo>
<q:Name>FRITZ!Box 7530 AX (UI)</q:Name>
<q:HW>256</q:HW>
<q:Major>256</q:Major>
<q:Minor>8</q:Minor>
<q:Patch>2</q:Patch>
<q:Buildnumber>117981</q:Buildnumber>
<q:Buildtype>1</q:Buildtype>
<q:Serial>DC15********</q:Serial>
<q:OEM>1und1</q:OEM>
<q:Lang>de</q:Lang>
<q:Country>049</q:Country>
<q:Annex>B</q:Annex>
<q:Flag>crashreport</q:Flag>
<q:Flag>avm_acs</q:Flag>
<q:Flag>medium_lan</q:Flag>
<q:Flag>medium_mobile</q:Flag>
<q:Flag>mesh_master_no_trusted</q:Flag>
<q:UpdateConfig>3</q:UpdateConfig>
<q:Provider>oma_lan</q:Provider>
<q:ProviderName></q:ProviderName></e:BoxInfo></e:BoxFirmwareUpdateCheck></soap:Body></soap:Envelope>HTTP/1.1 200 OK
Server: nginx/1.29.5
Date: Sat, 28 Feb 2026 15:12:49 GMT
Content-Type: text/xml;charset=UTF-8
Content-Length: 1866
Connection: keep-alive
download-delay: 118

<soap:Envelope xmlns:soap="http://schemas.xmlsoap.org/soap/envelope/"><SOAP-ENV:Header xmlns:SOAP-ENV="http://schemas.xmlsoap.org/soap/envelope/"/><soap:Body ID="Body"><ns2:BoxFirmwareUpdateCheckResponse xmlns:ns2="http://juis.avm.de/updateinfo" xmlns:ns3="http://juis.avm.de/response" xmlns:ns4="http://juis.avm.de/request"><ns2:ResponseUpdateInfo><ns3:ResponseHeader><ns3:Nonce>LMkr671Ey2xgw4rFPSTBSw==</ns3:Nonce></ns3:ResponseHeader><ns3:UpdateInfo><ns3:CheckInterval>48</ns3:CheckInterval><ns3:Found>false</ns3:Found><ns3:Version></ns3:Version><ns3:DownloadURL></ns3:DownloadURL><ns3:InfoURL></ns3:InfoURL><ns3:InfoText></ns3:InfoText><ns3:HintURL></ns3:HintURL><ns3:Priority>1</ns3:Priority><ns3:AutoUpdateStartTime>0</ns3:AutoUpdateStartTime><ns3:AutoUpdateEndTime>0</ns3:AutoUpdateEndTime><ns3:AutoUpdateKeepServices>true</ns3:AutoUpdateKeepServices></ns3:UpdateInfo></ns2:ResponseUpdateInfo></ns2:BoxFirmwareUpdateCheckResponse><Signature xmlns="http://www.w3.org/2000/09/xmldsig#"><SignedInfo><CanonicalizationMethod Algorithm="http://www.w3.org/2001/10/xml-exc-c14n#"/><SignatureMethod Algorithm="http://www.w3.org/2001/04/xmldsig-more#rsa-sha256"/><Reference URI="#Body"><Transforms><Transform Algorithm="http://www.w3.org/2000/09/xmldsig#enveloped-signature"/></Transforms><DigestMethod Algorithm="http://www.w3.org/2001/04/xmlenc#sha256"/><DigestValue>u9NccgdQ/fFZdqmbt1rMLw2Tu7ySAJoGUWkTyokIHxw=</DigestValue></Reference></SignedInfo><SignatureValue>V4rFTd5lozNTBWxU5R37JyRemU7ABPK/T7O2uqUoNDFhLIIepM/iGpwG+at45REVtHK2oxjEJvABbD/TJZ1LR/hHR2TXohV0ld15kg8Tf5adZplUAGqf9JFUoxwnLHNySHtCAc8qaG/nsq/ITAJzgCfpQG8RwcTNw98IQEFIikEo90biJbjxMPwVc8lkrPaSQO42a0Zq/dSSqx7JTvYiONBLuoTvGVxJNe4dwk+ZYlSd+30AJJDH2h1M5XpEGj9AghjS9o0BjZrJIAqkPcwHn3Csz71w1t07zt6ASsaXlGPNlWtqj0YYUcMM0CoD4OyelHJPzQpzMRgi/kCQFbt2Og==</SignatureValue></Signature></soap:Body></soap:Envelope>
```

</details>

<details>
  <summary>nginx config</summary>

- docker-compose.yml

```yml
  nginx:
    image: nginx:latest
    restart: always
    ports:
      - "80:80"
      - "443:443"
    volumes:
      # nginx conf
      - ./nginx.conf:/etc/nginx/nginx.conf:ro
      # nginx certs: key = "nginx.key"; cert = "nginx.crt"
      - ./certs:/etc/nginx/ssl:ro
      # logs
      - ./logs:/var/log/nginx
```

- nginx.conf

```json
events { }

http {


    log_format postdata $request_body;

    server {
        listen 80;
        server_name jws.avm.de;

        location / {
            proxy_pass https://jws.avm.de:443;
            proxy_set_header Host $host;
            proxy_set_header X-Real-IP $remote_addr;
            proxy_set_header X-Forwarded-For $proxy_add_x_forwarded_for;
            proxy_set_header X-Forwarded-Proto $scheme;
            access_log  /var/log/nginx/postdata.log  postdata;
        }
    }

    server {
        listen 443 ssl;
        server_name jws.avm.de;

        ssl_certificate /etc/nginx/ssl/nginx.crt;
        ssl_certificate_key /etc/nginx/ssl/nginx.key;

        ssl_protocols TLSv1.2;

        ssl_ciphers 'RSA+AES256:GCM+RSA:RSA+AES128:!ECDHE:!DHE:!aNULL:!MD5:!3DES';
        ssl_prefer_server_ciphers on;

        location / {
            proxy_pass https://jws.avm.de:443;
            proxy_set_header Host $host;
            proxy_set_header X-Real-IP $remote_addr;
            proxy_set_header X-Forwarded-For $proxy_add_x_forwarded_for;
            proxy_set_header X-Forwarded-Proto $scheme;
            access_log  /var/log/nginx/postdata.log  postdata;
        }
    }
}
```

</details>

**Comment by fda77** [comment]
Ich hab juis_check etwas erweitert 9b0b6bfacccef2ebe40a40cb4c21efed493e76d5, damit kann man die Anfrage wie deine oben erzeugen:
```
env -   tools/juis_check  --https     Version=256.08.2-116010 Name=FRITZ\!Box 7530 AX           HW=256         OEM=1und1 Lang=de Country=049 Buildtype=1 Annex=B UpdateConfig=3 Provider=oma_ipclient ProviderName=empty  ManualRequest=true  UserAgent=Box  Provider=oma_lan ProviderName="empty" Flag='crashreport avm_acs medium_lan medium_mobile mesh_master_no_trusted' -i -s -d
Using SSL:=y

Request:
################################################################
<soap:Envelope xmlns:soap="http://schemas.xmlsoap.org/soap/envelope/" xmlns:soap-enc="http://schemas.xmlsoap.org/soap/encoding/" xmlns:xsi="http://www.w3.org/2001/XMLSchema-instance" xmlns:xsd="http://www.w3.org/2001/XMLSchema" xmlns:e="http://juis.avm.de/updateinfo" xmlns:q="http://juis.avm.de/request">
<soap:Header/>
<soap:Body>
<e:BoxFirmwareUpdateCheck>
<e:RequestHeader>
<q:Nonce>naTBeaB0CvMUu18sHeS1ig==</q:Nonce>
<q:UserAgent>Box</q:UserAgent>
<q:ManualRequest>true</q:ManualRequest></e:RequestHeader>
<e:BoxInfo>
<q:Name>FRITZ!Box 7530 AX</q:Name>
<q:HW>256</q:HW>
<q:Major>256</q:Major>
<q:Minor>8</q:Minor>
<q:Patch>2</q:Patch>
<q:Buildnumber>116010</q:Buildnumber>
<q:Buildtype>1</q:Buildtype>
<q:Serial>504D36AC97C7</q:Serial>
<q:OEM>1und1</q:OEM>
<q:Lang>de</q:Lang>
<q:Country>049</q:Country>
<q:Annex>B</q:Annex>
<q:Flag>crashreport</q:Flag>
<q:Flag>avm_acs</q:Flag>
<q:Flag>medium_lan</q:Flag>
<q:Flag>medium_mobile</q:Flag>
<q:Flag>mesh_master_no_trusted</q:Flag>
<q:UpdateConfig>3</q:UpdateConfig>
<q:Provider>oma_lan</q:Provider>
<q:ProviderName></q:ProviderName></e:BoxInfo></e:BoxFirmwareUpdateCheck></soap:Body></soap:Envelope>
################################################################
```

geht aber noch immer nicht.

Da du das root-ca austauschen kannst, erstell dir doch eine eigen root-ca. Dann noch Zertifikat auf jws.avm.de das damit signiert ist.
Am besten angelehnt an
```
$ openssl s_client -connect jws.avm.de:443 -showcerts
Connecting to 2001:920:197e:400::126
CONNECTED(00000003)
depth=0 C=DE, ST=Berlin, O=AVM Computersysteme Vertriebs GmbH, OU=IT, CN=jws.avm.de, emailAddress=Admin@avm.de
verify error:num=20:unable to get local issuer certificate
verify return:1
depth=0 C=DE, ST=Berlin, O=AVM Computersysteme Vertriebs GmbH, OU=IT, CN=jws.avm.de, emailAddress=Admin@avm.de
verify error:num=21:unable to verify the first certificate
verify return:1
depth=0 C=DE, ST=Berlin, O=AVM Computersysteme Vertriebs GmbH, OU=IT, CN=jws.avm.de, emailAddress=Admin@avm.de
verify return:1
---
Certificate chain
 0 s:C=DE, ST=Berlin, O=AVM Computersysteme Vertriebs GmbH, OU=IT, CN=jws.avm.de, emailAddress=Admin@avm.de
   i:C=DE, ST=Berlin, L=Berlin, O=AVM Computersysteme Vertriebs GmbH, OU=IT, CN=AVM Root CA Certification Authority
   a:PKEY: RSA, 2048 (bit); sigalg: sha256WithRSAEncryption
   v:NotBefore: Sep 17 14:20:31 2021 GMT; NotAfter: Sep 15 14:20:31 2031 GMT

..................
```


Alternativ könnte man auch mit zb strace den Prozess der die Anfrage stellt anschauen (mit "-p" für PID, evtl noch ein "-f" dazu)

**Reply by LizenzFass78851** [reply]
> Da du das root-ca austauschen kannst, erstell dir doch eine eigen root-ca.

Hatte ich bereits gestern mit unter https://github.com/orgs/Freetz-NG/discussions/1415#discussioncomment-15955800 erwähnt. Da hatte ich das eigene Cert auch nicht nur auf der box sondern auch auf den ReverseProxy mit verwendet.
Davon das capture ist in verlinkten comment unter "Wireshark Output" zu finden

> > Nun habe ich das gleiche probiert aber mit den ReverseProxy mit HTTPs und einen eigenen Cert was ich auch auf die Box kopiert habe.
> > Ohne die SSL Cliper einzuschränken läuft die Verbindung per TLSv1.3 sowohl durch den ReverseProxy als auch von den ReverseProxy zum jws.avm.de Server.
Dann habe ich den ReverseProxy den Cliper auf TLSv1.2 ohne ECDHE geändert und das führte dazu das man zwar nun mit den eigenen Private Key den Capture auslesen kann aber wieder trotz HTTPs kein neues gefundenes Update.

**Reply by LizenzFass78851** [reply]
> Alternativ könnte man auch mit zb strace den Prozess der die Anfrage stellt anschauen

Da weiß ich nicht unter welchen Prozess der originale juis client von avm läuft da ich dahin keinen passenden Prozessnamen finde um daraus die PID abzuleiten. Lediglich die `libjuisclient.so` was möglicherweise nur eine library ist.

**Comment by fda77** [comment]
> das avm_root_ca.pem mit nanox oder vix ungeändert einmal beschreiben und es durch irgend ein anderes CA zu ersetzen. 

Das "irgend ein anderes " klang nicht unbedingt nach dem selbst erzeugten

**Comment by fda77** [comment]
Sieht nach ctlmgr aus:
```
strace  -fff -p 2762

[pid  2762] write(113, "POST /Jason/UpdateInfoService HT"..., 1024 <unfinished ...>
[pid 14110] clock_gettime(CLOCK_MONOTONIC, {tv_sec=8444, tv_nsec=122452023}) = 0
[pid  2762] <... write resumed>)        = 1024
[pid 14110] readlink("/usr" <unfinished ...>
[pid  2762] write(113, "g>mesh_master_no_trusted</q:Flag"..., 207 <unfinished ...>
```

Der legt auch eine ` cat /var/updatecheck.log` an
Und scheinbar werden die Versuche gezählt!
`request with id XXX issued`

Und eine /var/tmp/updatecheck
/var/InternerSpeicher/FRITZ/firmware_update.image
/var/InternerSpeicher/FRITZ/firmware_update.image.active
/var/InternerSpeicher/FRITZ/firmware_update.version

**Reply by fda77** [reply]
Das funktioniet sogar :)

`strace  -p $(pidof ctlmgr)  -s9999 2>&1 | grep ^write`

Zuerst fällt auf  das dos und linux Zeilenumbrüche gemischt darin sind -.-

**Comment by fda77** [comment]
@LizenzFass78851 Ich weiss nicht ob da private Daten drin sind, hab es mal gelöscht, serial auf jeden fall.

Da fehlen aber noch andere Dringe (ausser "write"), da muss man einfach suchen. Zb der "Envelope " Kopf

Es scheint jedenfalls eine neue Version der Anfrage zu sein

> <j:BoxInfo xmlns:j="http://jason.avm.de/updatecheck/">

zuerst sind die Tags (oder wie das heisst) nicht mehr Q sondern nun J, und hinter BoxInfo war kein xmlns früher. "<j:Lab>" könnte auch neu sein

**Reply by LizenzFass78851** [reply]
> Zb der "Envelope " Kopf

Besagtes habe ich in der vollen Ausgabe nicht gefunden.

**Reply by fda77** [reply]
@LizenzFass78851 Danke. nur Anhänge löschen geht übrigens nicht, sie bleiben dann mit "edit" drin

**Reply by fda77** [reply]
Ich glaub hatte das beim Testen drin, aber vielleicht liegt das an meinet alten 7490 Testbox

**Comment by fda77** [comment]
Das mit einem Proxy und untergeschobenem Zertifikat hab ich auch mal ausprobiert, geht. Allerdings nur mit meiner antiken 7490.
Das root-ca hab ich wie avm mit sha1 erstellt und proxy_ssl_verify=off auch damit das forwarding funktioniert. Evtl ging deshalb bei dir https nicht?
Jedenfalls kommt ich mit meiner alten Hardware nicht weiter und überlasse dieses Problem jemand anderem

Das Port :443 in deinem log kommt vermutlich aus nginx, ich nehm es aus juis_check wieder raus

**Reply by LizenzFass78851** [reply]
> Evtl ging deshalb bei dir https nicht?

Beim nginx musste ich nichts bezüglich dessen einstellen.
Das forwarding von `box -> nginx -> jws.avm.de` hatte ohne entsprechende Fehler beim nginx funktioniert.
Wahrscheinlich ist `proxy_ssl_verify` ohne Angabe in der config per default auf `off`.
https://nginx.org/en/docs/http/ngx_http_proxy_module.html#proxy_ssl_verify

**Comment by LizenzFass78851** [comment]
@fda77 

Die Liste aus https://github.com/orgs/Freetz-NG/discussions/1415#discussion-9389941 kann mit folgenden Inhalt aktualisiert werden:

```
FRITZ!Smart Gateway | 265

FRITZ!Box 6860 5G | 277
FRITZ!Box 7530 AX | 278
FRITZ!Box 5690 Pro | 279
FRITZ!Box 6670 Cable | 284
FRITZ!Box 7690 | 285
FRITZ!Box 7682 | 286
FRITZ!Box 4050 | 287
FRITZ!Repeater 1700 | 290
FRITZ!Box 4690 | 291
FRITZ!Box 5690 XGS | 295
FRITZ!Repeater 1200 AX v2 | 296
FRITZ!Box 6850 4G | 297
FRITZ!Box 5690 | 298
FRITZ!Repeater 2700 | 301
FRITZ!Box 7632 | 303
FRITZ!Repeater 1610 Outdoor | 305
FRITZ!Box 4630 | 307
FRITZ!Box 6690 Pro | 308
```

-----

### **Edit:**
Folgende Fritzbox scheint in den Stats nicht aufzutauchen:
`Product=Fritz_Box_HW306 (FRITZ!Box 6825 4G)`

**Reply by fda77** [reply]
https://freetz-ng.github.io/freetz-ng/stats/ wird automatisch aus den in freetz enthaltenen Geräten genertiert. Da 6825 noch keine firmware (auch keine .inhaus oder .labor) zum download hat ist sie dort noch nicht

Es fehlen auch noch weitere wie 7620, 7630 oder 6700, "ab HWR277" müsste aber ausreichen

**Comment by LizenzFass78851** [comment]
Ich habe nun mit `ltrace` das ganze auslesen wollen, dazu muss man wie folgt vorgehen:

- avm watchdog ausschalten

```bash
echo disable > /dev/watchdog
```

- Dann den ctlmgr beenden und den Prozess neustarten

```bash
kill -9 $(pidof ctlmgr)
ctlmgr
```

- Dann ausschließlich per http auf die UI der Box gehen bis zum Update Fenster

- Dann eine Vorlage für ltrace erstellen

```bash
nano /var/mod/etc/ltrace.conf
```

Mit folgenden Inhalt **(aktuallisiert)**

```c
int avmssl_write(void*, string, int, void*);
int avmssl_read(void*, +string, int, int);
```

- Dann ltrace starten (getestet mit ltrace 0.8.1, siehe https://github.com/orgs/Freetz-NG/discussions/1526#discussioncomment-17296199)

```bash
ltrace -F /var/mod/etc/ltrace.conf -s 8192 -e avmssl_write+avmssl_read -p $(pidof ctlmgr)
```

- Dann in der Web UI auf Update suchen klicken.

- Dann kommt folgende Ausgabe:

**Ausgabe 2x aktuallisiert**

<details><summary>Ausgabe</summary>

```
libavmcsock.so.2->avmssl_read(0xb4cac000, "", 32768, 36)                                                              = -1
libavmcsock.so.2->avmssl_write(0xb4cac000, "POST /fritzos/authorization/v1/token HTTP/1.1\r\nContent-Length: 22\r\nContent-Type: application/x-www-form-urlencoded\r\nHost: dca.avm.de\r\nConnection: close\r\n\r\nclient_id=DC15C8XXXXXXI\223\265\001\207\351\242\217\030\356\361\351\304-6\26301L\215\220f\244\357\250\226J\277\023Q\266\037\335\fm`\313\rA\275\377\333H\274\1770s5\030\310m\003\261\320\356\212\213\347\025\3428\a\253AA\242\225T\254\225\004q&\271#{D\277\233\270\271\337\340\035\237p\2720\231\274\312V\032\203\310A\313D\235f.dT\377\224\257v\333\225\271132X'\227f\322\331\223\371\234\035]'f\021\a\363\301\332\266\272\357\243\355G\310\217\271t\202W\016\354y\227\203\361"\320\213\227\b\261\321\022r\203\205\337\002\225\327m\355@Y\337\335\302\257l\203[\005}+Jq{\203>_\332A\\\240-\304\261\322\331\231\363\271b\372\375\350:\027M\214;\333\304Y:\343'.\253\304D}#x\302`\211", 177, 0xb3097dd0) = 177
libavmcsock.so.2->avmssl_read(0xb4cac000, "HTTP/1.1 200 OK\r\ncache-control: no-store\r\nset-cookie: JSESSIONID=AUucLF7gSkk8XEf49zBL04ZAUxYMXL_JhueJpjcA.juis-dca-01; path=/\r\npragma: no-cache\r\ncontent-type: application/json\r\ncontent-length: 1123\r\ndate: Sun, 14 Jun 2026 11:30:40 GMT\r\nconnection: close\r\n\r\n{"access_token":"eyJraWQiOiJNQV9xSzY5UDVaS1h0UkdwZExmLTFSRHkxVkJMWVl2Vko0Um1EZXpCMl9nIiwiYWxnIjoiUlMyNTYifQ.eyJhdWQiOlsid2Vic2VydmljZS5teWZyaXR6Lm5ldCIsImp3cy5hdm0uZGUiLCJhcGkuYXZtLmRlIl0sInN1YiI6IkRDMTVDODQ0NTBBMyIsImlzcyI6Imh0dHBzOi8vZGNhLmF2bS5kZS9mcml0em9zL2F1dGhvcml6YXRpb24vdjEvdG9rZW4iLCJjbmYiOnsieDV0I1MyNTYiOiJScGhsTXhVUkhJeElLRWFRYVhfVVBfVHZhSGFUYWNJYVVqZy1XMkdUN280In0sImV4cCI6MTc4MTQ0MDI0MCwiaWF0IjoxNzgxNDM2NjQwLCJqdGkiOiIwYWUzZGE2MS1mYTE2LTQxZmItOGE4Ni1jMDkwNTZmNDJmMzMiLCJjbGllbnRfaWQiOiJEQzE1Qzg0NDUwQTMiLCJoYXJkd2FyZV9pZCI6MjU2LCJjZXJ0aWZpY2F0ZV9pbmZvIjp7ImxldmVsIjoxLCJtYW51ZmFjdHVyZXJfY2EiOiJBVk0gRGV2aWNlIE1hbnVmYWN0dXJlciBDQSAzNTAyNzc2IiwicHJvZHVjZXJfY2EiOiJBVk0gRGV2aWNlIFByb2R1Y3Rpb24gQ0EgMDg3NTYyMTEgNjU0NzIwMSJ9fQ.W7Prw0OEv9rbga50Xf98ZLm9Q2wo-wPZJJ_bXwWlsz0MqcT4xtUfjUcC-PRng6gZ2inICWyqsAUo-_t1mmIIsKLYNvBr2Wse_TxhB94o3FMWOwwRHpegnBciQPRiiUXNi7r5S2DrDlr5BPGJN9qU04aVarmbWW6AOFgNAQTHVF1WaGJxHoofJSWXv1w-peh-klQh4K7U8SkGspW3yitT5IrS_6rnvFS_mpjHv_MOYTZPThqxm4mDr1LU44cp-qt3t3AJi2DLB9A-JAJtupjIVruYjPeUEDaiqCvLI9vSQtdET31Vr7cu-DeV6GO2gB5ReKa5BYNw4MiUJMbvyxmenw","token_type":"Bearer","expires_in":3600}", 32768, 36) = 1380
--- SIGCHLD (Child exited) ---
libavmcsock.so.2->avmssl_read(0xb2fb1000, "event_device_update {\nevent_type = EVENT_TYPE_FULL_FETCH;\nupdates {\ndev_id = 1;\nversion = VERSION_IEEE1905_1;\nnames {\ntype = NAME_TYPE_DEVICE;\nname = "fritz-bridge-lte";\n}\nmanufacturer_name = "AVM";\nmanufacturer_model = "FRITZ!Box 7530 AX (UI)";\nsoftware_version = "256.08.02";\nmeshrole = MESHROLE_MASTER;\ncapabilities = 28;\nenabled_capabilities = 28;\ndevice_mac_learned_via_lldp = no;\nis_meshed = yes;\ndevice_mac = DC:15:C8:XX:XX:XX;\nwan_stats_valid = yes;\nwan_stats_last_updated = 1781436639s;\nwan_stats_bytes_sent = 127710;\nwan_stats_bytes_received = 335120;\n} {\ndev_id = 14;\nversion = VERSION_IEEE1905_1;\nnames {\ntype = NAME_TYPE_DEVICE;\nname = "PC-NAME";\n}\nmanufacturer_name = "";\nmanufacturer_model = "";\nsoftware_version = "";\nmeshrole = MESHROLE_UNKNOWN;\ncapabilities = 0;\nenabled_capabilities = 0;\ndevice_mac_learned_via_lldp = no;\nis_meshed = no;\ndevice_mac = XX:XX:XX:XX:XX:XX;\ndevice_vendor_class_id = "MSFT 5.0";\nwan_stats_valid = yes;\nwan_stats_last_updated = 1781436639s;\nwan_stats_bytes_sent = 4917;\nwan_stats_bytes_received = 3384;\n}\n}\n", 32768, 36) = -1
libavmcsock.so.2->avmssl_write(0xb2fb1000, "POST /Jason/UpdateInfoService HTTP/1.1\r\nHost: jws.avm.de:443\r\nAuthorization: Bearer eyJraWQiOiJNQV9xSzY5UDVaS1h0UkdwZExmLTFSRHkxVkJMWVl2Vko0Um1EZXpCMl9nIiwiYWxnIjoiUlMyNTYifQ.eyJhdWQiOlsid2Vic2VydmljZS5teWZyaXR6Lm5ldCIsImp3cy5hdm0uZGUiLCJhcGkuYXZtLmRlIl0sInN1YiI6IkRDMTVDODQ0NTBBMyIsImlzcyI6Imh0dHBzOi8vZGNhLmF2bS5kZS9mcml0em9zL2F1dGhvcml6YXRpb24vdjEvdG9rZW4iLCJjbmYiOnsieDV0I1MyNTYiOiJScGhsTXhVUkhJeElLRWFRYVhfVVBfVHZhSGFUYWNJYVVqZy1XMkdUN280In0sImV4cCI6MTc4MTQ0MDI0MCwiaWF0IjoxNzgxNDM2NjQwLCJqdGkiOiIwYWUzZGE2MS1mYTE2LTQxZmItOGE4Ni1jMDkwNTZmNDJmMzMiLCJjbGllbnRfaWQiOiJEQzE1Qzg0NDUwQTMiLCJoYXJkd2FyZV9pZCI6MjU2LCJjZXJ0aWZpY2F0ZV9pbmZvIjp7ImxldmVsIjoxLCJtYW51ZmFjdHVyZXJfY2EiOiJBVk0gRGV2aWNlIE1hbnVmYWN0dXJlciBDQSAzNTAyNzc2IiwicHJvZHVjZXJfY2EiOiJBVk0gRGV2aWNlIFByb2R1Y3Rpb24gQ0EgMDg3NTYyMTEgNjU0NzIwMSJ9fQ.W7Prw0OEv9rbga50Xf98ZLm9Q2wo-wPZJJ_bXwWlsz0MqcT4xtUfjUcC-PRng6gZ2inICWyqsAUo-_t1mmIIsKLYNvBr2Wse_TxhB94o3FMWOwwRHpegnBciQPRiiUXNi7r5S2DrDlr5BPGJN9qU04aVarmbWW6AOFgNAQTHVF1WaGJxHoofJSWXv1w-peh-klQh4K7U8SkGspW3yitT5IrS_", 62, 0xb307d048) = 62
libavmcsock.so.2->avmssl_write(0xb2fb1000, "Authorization: Bearer eyJraWQiOiJNQV9xSzY5UDVaS1h0UkdwZExmLTFSRHkxVkJMWVl2Vko0Um1EZXpCMl9nIiwiYWxnIjoiUlMyNTYifQ.eyJhdWQiOlsid2Vic2VydmljZS5teWZyaXR6Lm5ldCIsImp3cy5hdm0uZGUiLCJhcGkuYXZtLmRlIl0sInN1YiI6IkRDMTVDODQ0NTBBMyIsImlzcyI6Imh0dHBzOi8vZGNhLmF2bS5kZS9mcml0em9zL2F1dGhvcml6YXRpb24vdjEvdG9rZW4iLCJjbmYiOnsieDV0I1MyNTYiOiJScGhsTXhVUkhJeElLRWFRYVhfVVBfVHZhSGFUYWNJYVVqZy1XMkdUN280In0sImV4cCI6MTc4MTQ0MDI0MCwiaWF0IjoxNzgxNDM2NjQwLCJqdGkiOiIwYWUzZGE2MS1mYTE2LTQxZmItOGE4Ni1jMDkwNTZmNDJmMzMiLCJjbGllbnRfaWQiOiJEQzE1Qzg0NDUwQTMiLCJoYXJkd2FyZV9pZCI6MjU2LCJjZXJ0aWZpY2F0ZV9pbmZvIjp7ImxldmVsIjoxLCJtYW51ZmFjdHVyZXJfY2EiOiJBVk0gRGV2aWNlIE1hbnVmYWN0dXJlciBDQSAzNTAyNzc2IiwicHJvZHVjZXJfY2EiOiJBVk0gRGV2aWNlIFByb2R1Y3Rpb24gQ0EgMDg3NTYyMTEgNjU0NzIwMSJ9fQ.W7Prw0OEv9rbga50Xf98ZLm9Q2wo-wPZJJ_bXwWlsz0MqcT4xtUfjUcC-PRng6gZ2inICWyqsAUo-_t1mmIIsKLYNvBr2Wse_TxhB94o3FMWOwwRHpegnBciQPRiiUXNi7r5S2DrDlr5BPGJN9qU04aVarmbWW6AOFgNAQTHVF1WaGJxHoofJSWXv1w-peh-klQh4K7U8SkGspW3yitT5IrS_6rnvFS_mpjHv_MOYTZPThqxm4mDr1LU44cp-qt3t3AJi2DLB9A-JAJtupjIVruYjPeUEDaiqCvLI9vSQtdET31Vr7cu-DeV6GO2gB5ReKa5BYNw4MiUJMbvyxmenw\r\nContent-Length: 1157\r\nContent-Type: text/xml; charset="utf-8"\r\n\r\n\n<soap:Envelope xmlns:soap="http://schemas.xmlsoap.org/soap/envelope/" xmlns:soap-enc="http://schemas.xmlsoap.org/soap/encoding/" xmlns:xsi="http://www.w3.org/2001/XMLSchema-instance" xmlns:xsd="http://www.w3.org/2001/XMLSchema" xmlns:e="http://juis.avm.de/updateinfo" xmlns:q="http://juis.avm.de/request">\n<soap:Header/>\n<soap:Body>\n<e:BoxFirmwareUpdateCheck>\n<e:RequestHeader>\n<q:Nonce>QWsDft/cHi6HBWNRrh9OkQ==</q:Nonce>\n<q:UserAgent>Box</q:UserAgent>\n<q:ManualRequest>true</q:ManualRequest></e:RequestHeader>\n<e:BoxInfo>\n<q:Name>FRITZ!Box 7530 AX (UI)</q:Name>\n<q:HW>256</q:HW>\n<q:Major>256</q:Major>\n<q:Minor>8</q:Minor>\n<q:Patch>2</q:Patch>\n<q:Buildnumber>117981</q:Buildnumber>\n<q:Buildtype>1</q:Buildtype>\n<q:Serial>DC15C8XXXXXX</q:Serial>\n<q:OEM>1und1</q:OEM>\n<q:Lang>de</q:Lang>\n<q:Country>049</q:Country>\n<q:Annex>B</q:Annex>\n<q:Flag>crashreport</q:Flag>\n<q:Flag>avm_acs</q:Flag>\n<q:Fl\216f\023\371\020", 2048, 0xb30978d0) = 2048
libavmcsock.so.2->avmssl_write(0xb2fb1000, "ag>medium_lan</q:Flag>\n<q:Flag>medium_mobile</q:Flag>\n<q:Flag>mesh_master_no_trusted</q:Flag>\n<q:UpdateConfig>3</q:UpdateConfig>\n<q:Provider>oma_lan</q:Provider>\n<q:ProviderName></q:ProviderName></e:BoxInfo></e:BoxFirmwareUpdateCheck></soap:Body></soap:Envelope>;without_zero"}\n},\nview={\nregistration={\nsip_active={edit={}},\nprovider={wizard={view_rule="postion_cable_top"},edit={view_rule="postion_cable_top"}},\nfirstnumber={wizard={view_rule="is_areacode"},edit={view_rule="is_areacode"},txt={label="str_4"}},\nsecondnumber={txt={}},\nscreen_name={edit={},txt={label="str_30"}}\n},\naccessdata={\npassword={txt={label="str_27"}}\n},\nconnectionsettings={\nroute_always_over_internet={edit={}},\nvoip_over_mobile={}\n}},\nloadRule={\nfirstnumber={rule="number;without_msn"},\nsecondnumber={rule="msnnum"},\nusername={rule="empty"}\n}\n}\n", 262, 0xb3097910) = 262
libavmcsock.so.2->avmssl_read(0xb2fb1000, "event_device_update {\nevent_type = EVENT_TYPE_FULL_FETCH;\nupdates {\ndev_id = 1;\nversion = VERSION_IEEE1905_1;\nnames {\ntype = NAME_TYPE_DEVICE;\nname = "fritz-bridge-lte";\n}\nmanufacturer_name = "AVM";\nmanufacturer_model = "FRITZ!Box 7530 AX (UI)";\nsoftware_version = "256.08.02";\nmeshrole = MESHROLE_MASTER;\ncapabilities = 28;\nenabled_capabilities = 28;\ndevice_mac_learned_via_lldp = no;\nis_meshed = yes;\ndevice_mac = DC:15:C8:XX:XX:XX;\nwan_stats_valid = yes;\nwan_stats_last_updated = 1781436639s;\nwan_stats_bytes_sent = 127710;\nwan_stats_bytes_received = 335120;\n} {\ndev_id = 14;\nversion = VERSION_IEEE1905_1;\nnames {\ntype = NAME_TYPE_DEVICE;\nname = "PC-NAME";\n}\nmanufacturer_name = "";\nmanufacturer_model = "";\nsoftware_version = "";\nmeshrole = MESHROLE_UNKNOWN;\ncapabilities = 0;\nenabled_capabilities = 0;\ndevice_mac_learned_via_lldp = no;\nis_meshed = no;\ndevice_mac = XX:XX:XX:XX:XX:XX;\ndevice_vendor_class_id = "MSFT 5.0";\nwan_stats_valid = yes;\nwan_stats_last_updated = 1781436639s;\nwan_stats_bytes_sent = 4917;\nwan_stats_bytes_received = 3384;\n}\n}\n", 32768, 36) = -1
libavmcsock.so.2->avmssl_read(0xb2fb1000, "HTTP/1.1 200 OK\r\ndownload-delay: 242\r\ncontent-type: text/xml;charset=UTF-8\r\ncontent-length: 2178\r\ndate: Sun, 14 Jun 2026 11:30:41 GMT\r\n\r\n<soap:Envelope xmlns:soap="http://schemas.xmlsoap.org/soap/envelope/"><SOAP-ENV:Header xmlns:SOAP-ENV="http://schemas.xmlsoap.org/soap/envelope/"/><soap:Body ID="Body"><ns2:BoxFirmwareUpdateCheckResponse xmlns:ns2="http://juis.avm.de/updateinfo" xmlns:ns3="http://juis.avm.de/response" xmlns:ns4="http://juis.avm.de/request"><ns2:ResponseUpdateInfo><ns3:ResponseHeader><ns3:Nonce>QWsDft/cHi6HBWNRrh9OkQ==</ns3:Nonce></ns3:ResponseHeader><ns3:UpdateInfo><ns3:CheckInterval>48</ns3:CheckInterval><ns3:Found>true</ns3:Found><ns3:Name>EXTERN RELEASE SMART24 P2 NL1 deutsche info.txt</ns3:Name><ns3:Version>256.08.25</ns3:Version><ns3:Type>1</ns3:Type><ns3:DownloadURL>http://download.avm.de/fritzbox/fritzbox-7530-ax/deutschland/fritz.os/FRITZ.Box_7530_AX-08.25.image</ns3:DownloadURL><ns3:InfoURL>http://download.avm.de/fritzbox/fritzbox-7530-ax/deutschland/fritz.os/info_de.txt</ns3:InfoURL><ns3:InfoText></ns3:InfoText><ns3:HintURL></ns3:HintURL><ns3:IconURL></ns3:IconURL><ns3:Priority>1</ns3:Priority><ns3:AutoUpdateStartTime>1800</ns3:AutoUpdateStartTime><ns3:AutoUpdateEndTime>18000</ns3:AutoUpdateEndTime><ns3:AutoUpdateKeepServices>true</ns3:AutoUpdateKeepServices></ns3:UpdateInfo></ns2:ResponseUpdateInfo></ns2:BoxFirmwareUpdateCheckResponse><Signature xmlns="http://www.w3.org/2000/09/xmldsig#"><SignedInfo><CanonicalizationMethod Algorithm="http://www.w3.org/2001/10/xml-exc-c14n#"/><SignatureMethod Algorithm="http://www.w3.org/2001/04/xmldsig-more#rsa-sha256"/><Reference URI="#Body"><Transforms><Transform Algorithm="http://www.w3.org/2000/09/xmldsig#enveloped-signature"/></Transforms><DigestMethod Algorithm="http://www.w3.org/2001/04/xmlenc#sha256"/><DigestValue>Gh+GVFub448aG1n4n2a6MOp9pdg/RvzIWPHbYlLmNZk=</DigestValue></Reference></SignedInfo><SignatureValue>U7I0bqyc/WGSxWoYUsOxuuFKqBJ+02U+0j5XzhP7xtgvCtE+IuzJrU4plgYKALtAhJ9nJTxWjB3/iA95Q59ncMi4WkPVUhATXcxCPxZarjmSLhnmOmsJ6OZhO9OxVCUzQ43WXc8YmsD4l9G9RD/8KFNg/5mpm4WMlT9kjxaFGJw3Cq/nwRCt0SwkWct0170797SaxcKsdbSjPxlJe3BO1nyo/cCD1fI5yVx0MoOPM775cI1MvGbcpl/1GHFkiqAQU3WlW2RW2TrKsoWTnwTdJjT6jgjP1wBeCJTXQXfpdgg5C2qkM3Gu1jytJKf8QZc5/do5D3j2sCn4bl94rrdWzw==</SignatureValue></Signature></soap:Body></soap:Envelope>", 32768, 36) = 2315
```

<p>



</p>
</details>

**Reply by LizenzFass78851** [reply]
Vermuttlich holt, die Fritzbox sich einen Token und nimmt das Authentifizierung für die Juis-Anfrage.
Warscheinlich liegt das daran das für neuere Boxen keine Juis Antwort erfolgt ohne Token.

**Comment by fda77** [comment]
Nicht schlecht!
Da hat sich wohl einiges geändert. Den Host: dca.avm.de kannte ich bislang nicht. Was zuerst auffällt, dass AVM immer noch dos-Zeilenumbrüche verwendet ('\r\n') - aber nicht überall.
Diese "Authorization: Bearer" kenne ich von Blink, immerhin ist das nicht was selbst gebasteltes!
Hast du eine Ahnung woher die "client_id" kommt? Evtl hilft "cat /proc/sys/urlader/environment" weiter

**Reply by LizenzFass78851** [reply]
> Hast du eine Ahnung woher die "client_id" kommt?

> `client_id=DC15C8XXXXXX`

Das ist die MAC-Adresse von maca:



`maca    DC:15:C8:XX:XX:XX`

**Comment by fda77** [comment]
Aber zuerst mal zum 1. Request mit "Content-Length: 22": Das ab dem "I" hinter der client_id scheint ein certificate zu sein das gesendet wird:
```
curl 'https://dca.avm.de/fritzos/authorization/v1/token' \
  -X POST \
  -H 'Content-Type: application/x-www-form-urlencoded' \
  -H 'Connection: close' \
  --data 'client_id=XX1234567890' \
  --cacert 'tools/avm-rootca.pem' \

curl: (56) OpenSSL SSL_read: OpenSSL/3.5.5: error:0A00045C:SSL routines::tlsv13 alert certificate required, errno 0

```

Es KÖNNTE sein dass dieses certificate einfach die signatur des payloads (der client_id ist)

Übrigens kann man sich mit strace an einen laufenden prozess(-pid) anhängen

**Reply by LizenzFass78851** [reply]
> Übrigens kann man sich mit strace an einen laufenden prozess(-pid) anhängen

Wenn ich danach suche was es für Zertifikarten abruft, sind es folgende:

```
openat(AT_FDCWD, "/var/tmp/websrv_ssl_cert.pem", O_RDONLY|O_LARGEFILE) = 149
openat(AT_FDCWD, "/var/tmp/websrv_ssl_cert.pem", O_RDONLY|O_LARGEFILE) = 149
openat(AT_FDCWD, "/var/tmp/websrv_ssl_cert.pem", O_RDONLY|O_LARGEFILE) = 149
openat(AT_FDCWD, "/etc/avm_root_ca.pem", O_RDONLY|O_LARGEFILE) = 143
openat(AT_FDCWD, "/GU/OPENSSL_brcma9_build/packages/openssl-main/usr/cert.pem", O_RDONLY|O_LARGEFILE) = -1 ENOENT (No such file or directory)
```

**Comment by fda77** [comment]
Wenn du schon einen "Bearer" hast und der nciht abgelaufen ist (ich glaub bei blink sind es 4 Stunden):
```
curl 'https://jws.avm.de:443/Jason/UpdateInfoService' \
  --cacert 'tools/avm-rootca.pem' \
  -X POST \
  -H 'Host: jws.avm.de' \
  -H 'Authorization: Bearer eyJraWQiOiJNQV9xSzY5UDVaS1h0UkdwZExmLTFSRHkxVkJMWVl2Vko0Um1EZXpCMl9nIiwiYWxnIjoiUlMyNTYifQ.eyJhdWQiOlsid2Vic2VydmljZS5teWZyaXR6Lm5ldCIsImp3cy5hdm0uZGUiLCJhcGkuYXZtLmRlIl0sInN1YiI6IkRDMTVDODQ0NTBBMyIsImlzcyI6Imh0dHBzOi8vZGNhLmF2bS5kZS9mcml0em9zL2F1dGhvcml6YXRpb24vdjEvdG9rZW4iLCJjbmYiOnsieDV0I1MyNTYiOiJScGhsTXhVUkhJeElLRWFRYVhfVVBfVHZhSGFUYWNJYVVqZy1XMkdUN280In0sImV4cCI6MTc4MTQ0MDI0MCwiaWF0IjoxNzgxNDM2NjQwLCJqdGkiOiIwYWUzZGE2MS1mYTE2LTQxZmItOGE4Ni1jMDkwNTZmNDJmMzMiLCJjbGllbnRfaWQiOiJEQzE1Qzg0NDUwQTMiLCJoYXJkd2FyZV9pZCI6MjU2LCJjZXJ0aWZpY2F0ZV9pbmZvIjp7ImxldmVsIjoxLCJtYW51ZmFjdHVyZXJfY2EiOiJBVk0gRGV2aWNlIE1hbnVmYWN0dXJlciBDQSAzNTAyNzc2IiwicHJvZHVjZXJfY2EiOiJBVk0gRGV2aWNlIFByb2R1Y3Rpb24gQ0EgMDg3NTYyMTEgNjU0NzIwMSJ9fQ.W7Prw0OEv9rbga50Xf98ZLm9Q2wo-wPZJJ_bXwWlsz0MqcT4xtUfjUcC-PRng6gZ2inICWyqsAUo-_t1mmIIsKLYNvBr2Wse_TxhB94o3FMWOwwRHpegnBciQPRiiUXNi7r5S2DrDlr5BPGJN9qU04aVarmbWW6AOFgNAQTHVF1WaGJxHoofJSWXv1w-peh-klQh4K7U8SkGspW3yitT5IrS_' \
  -H 'Content-Type: text/xml; charset=utf-8' \
  --data-binary $'<?xml version="1.0"?>\n<soap:Envelope xmlns:soap="http://schemas.xmlsoap.org/soap/envelope/" xmlns:e="http://juis.avm.de/updateinfo" xmlns:q="http://juis.avm.de/request">\n<soap:Header/>\n<soap:Body>\n<e:BoxFirmwareUpdateCheck>\n<e:RequestHeader>\n<q:Nonce>QWsDft/cHi6HBWNRrh9OkQ==</q:Nonce>\n<q:UserAgent>Box</q:UserAgent>\n<q:ManualRequest>true</q:ManualRequest>\n</e:RequestHeader>\n<e:BoxInfo>\n<q:Name>FRITZ!Box 7530 AX (UI)</q:Name>\n<q:HW>256</q:HW>\n<q:Major>256</q:Major>\n<q:Minor>8</q:Minor>\n<q:Patch>2</q:Patch>\n<q:Buildnumber>117981</q:Buildnumber>\n<q:Buildtype>1</q:Buildtype>\n<q:Serial>DC15C84450A3</q:Serial>\n<q:OEM>1und1</q:OEM>\n<q:Lang>de</q:Lang>\n<q:Country>049</q:Country>\n<q:Annex>B</q:Annex>\n<q:Flag>crashreport</q:Flag>\n<q:Flag>avm_acs</q:Flag>\n<q:Flag>medium_lan</q:Flag>\n<q:Flag>medium_mobile</q:Flag>\n<q:Flag>mesh_master_no_trusted</q:Flag>\n<q:UpdateConfig>3</q:UpdateConfig>\n<q:Provider>oma_lan</q:Provider>\n</e:BoxInfo>\n</e:BoxFirmwareUpdateCheck>\n</soap:Body>\n</soap:Envelope>'
  ```

**Reply by LizenzFass78851** [reply]
Ich habe da ich da nicht ganz durchblicke eine AI meine Ergebnisse auswerten lassen und da kommt neben der client_id folgende heraus:

<details><summary>AI Answer</summary>
<p>

Der komplette im Trace sichtbare Bearer-Token lautet:

```text
Bearer eyJraWQiOiJNQV9xSzY5UDVaS1h0UkdwZExmLTFSRHkxVkJMWVl2Vko0Um1EZXpCMl9nIiwiYWxnIjoiUlMyNTYifQ.eyJhdWQiOlsid2Vic2VydmljZS5teWZyaXR6Lm5ldCIsImp3cy5hdm0uZGUiLCJhcGkuYXZtLmRlIl0sInN1YiI6IkRDMTVDODQ0NTBBMyIsImlzcyI6Imh0dHBzOi8vZGNhLmF2bS5kZS9mcml0em9zL2F1dGhvcml6YXRpb24vdjEvdG9rZW4iLCJjbmYiOnsieDV0I1MyNTYiOiJScGhsTXhVUkhJeElLRWFRYVhfVVBfVHZhSGFUYWNJYVVqZy1XMkdUN280In0sImV4cCI6MTc4MTQ0NjA5NCwiaWF0IjoxNzgxNDQyNDk0LCJqdGkiOiI2ZGIxMmUyMS04NjI2LTQ4YjMtODdhOC1iY2UwMTNhY2NkNmYiLCJjbGllbnRfaWQiOiJEQzE1Qzg0NDUwQTMiLCJoYXJkd2FyZV9pZCI6MjU2LCJjZXJ0aWZpY2F0ZV9pbmZvIjp7ImxldmVsIjoxLCJtYW51ZmFjdHVyZXJfY2EiOiJBVk0gRGV2aWNlIE1hbnVmYWN0dXJlciBDQSAzNTAyNzc2IiwicHJvZHVjZXJfY2EiOiJBVk0gRGV2aWNlIFByb2R1Y3Rpb24gQ0EgMDg3NTYyMTEgNjU0NzIwMSJ9fQ.O_j1YuYjF4fgTdQOIoIJl2IySHR3veuvls2AHLMXdbh0ZfLybE_E38xiay_CQpmzv92Hjq7imzoCrtwM3wQqC7qUoDPCWbbT9QRsGZgcJnVEbPDV9RNEZF5bw9IJqkzIm0DPpZq977X_QgPUUpUmLuppJ1o6_IFtZReeX2WO--L8UmCsa_dC3Cj5sTmSB5gf9cyX_WVLEI-CpLAJAddZp5m6Vh-GjlQgNjTVcm6poTnkIr4fA5FZR1jYm0CWps_3C4JMRNwjghmoqKK7OlpXnmW5iEFgcyEPDdAYD4xhDOT-uaSfyfOgNxxNlptGi4jA_RSIuD8n2vdp5lt1q5ZPmg
```

Aus dem JWT-Payload (mittlerer Teil) lassen sich außerdem folgende Informationen direkt dekodieren:

* `client_id`: `DC15C8XXXXXX`
* `sub`: `DC15C8XXXXXX`
* `hardware_id`: `256`
* Aussteller (`iss`): `https://dca.avm.de/fritzos/authorization/v1/token`
* Zielsysteme (`aud`):

  * `webservice.myfritz.net`
  * `jws.avm.de`
  * `api.avm.de`
* JWT-ID (`jti`):

  * `6db12e21-8626-48b3-87a8-bce013accd6f`

Die Zeitstempel im Token entsprechen:

* `iat = 1781442494` → 14.06.2026 13:21:34 UTC
* `exp = 1781446094` → 14.06.2026 14:21:34 UTC

also einer Gültigkeit von genau **1 Stunde**.



</p>
</details>

**Reply by LizenzFass78851** [reply]
Mit den Beispiel Befehl habe ich mit einen Gültigen token folgendes Ergebnis:

```
curl 'https://jws.avm.de:443/Jason/UpdateInfoService' \
  --cacert 'tools/avm-rootca.pem' \
  -X POST \
  -H 'Host: jws.avm.de' \
  -H 'Authorization: Bearer eyJraWQiOiJNQV9xSzY5UDVaS1h0UkdwZExmLTFSRHkxVkJMWVl2Vko0Um1EZXpCMl9nIiwiYWxnIjoiUlMyNTYifQ.eyJhdWQiOlsid2Vic2VydmljZS5teWZyaXR6Lm5ldCIsImp3cy5hdm0uZGUiLCJhcGkuYXZtLmRlIl0sInN1YiI6IkRDMTVDODQ0NTBBMyIsImlzcyI6Imh0dHBzOi8vZGNhLmF2bS5kZS9mcml0em9zL2F1dGhvcml6YXRpb24vdjEvdG9rZW4iLCJjbmYiOnsieDV0I1MyNTYiOiJScGhsTXhVUkhJeElLRWFRYVhfVVBfVHZhSGFUYWNJYVVqZy1XMkdUN280In0sImV4cCI6MTc4MTQ0NjA5NCwiaWF0IjoxNzgxNDQyNDk0LCJqdGkiOiI2ZGIxMmUyMS04NjI2LTQ4YjMtODdhOC1iY2UwMTNhY2NkNmYiLCJjbGllbnRfaWQiOiJEQzE1Qzg0NDUwQTMiLCJoYXJkd2FyZV9pZCI6MjU2LCJjZXJ0aWZpY2F0ZV9pbmZvIjp7ImxldmVsIjoxLCJtYW51ZmFjdHVyZXJfY2EiOiJBVk0gRGV2aWNlIE1hbnVmYWN0dXJlciBDQSAzNTAyNzc2IiwicHJvZHVjZXJfY2EiOiJBVk0gRGV2aWNlIFByb2R1Y3Rpb24gQ0EgMDg3NTYyMTEgNjU0NzIwMSJ9fQ.O_j1YuYjF4fgTdQOIoIJl2IySHR3veuvls2AHLMXdbh0ZfLybE_E38xiay_CQpmzv92Hjq7imzoCrtwM3wQqC7qUoDPCWbbT9QRsGZgcJnVEbPDV9RNEZF5bw9IJqkzIm0DPpZq977X_QgPUUpUmLuppJ1o6_IFtZReeX2WO--L8UmCsa_dC3Cj5sTmSB5gf9cyX_WVLEI-CpLAJAddZp5m6Vh-GjlQgNjTVcm6poTnkIr4fA5FZR1jYm0CWps_3C4JMRNwjghmoqKK7OlpXnmW5iEFgcyEPDdAYD4xhDOT-uaSfyfOgNxxNlptGi4jA_RSIuD8n2vdp5lt1q5ZPmg' \
  -H 'Content-Type: text/xml; charset=utf-8' \
  --data-binary $'<?xml version="1.0"?>\n<soap:Envelope xmlns:soap="http://schemas.xmlsoap.org/soap/envelope/" xmlns:e="http://juis.avm.de/updateinfo" xmlns:q="http://juis.avm.de/request">\n<soap:Header/>\n<soap:Body>\n<e:BoxFirmwareUpdateCheck>\n<e:RequestHeader>\n<q:Nonce>QWsDft/cHi6HBWNRrh9OkQ==</q:Nonce>\n<q:UserAgent>Box</q:UserAgent>\n<q:ManualRequest>true</q:ManualRequest>\n</e:RequestHeader>\n<e:BoxInfo>\n<q:Name>FRITZ!Box 7530 AX (UI)</q:Name>\n<q:HW>256</q:HW>\n<q:Major>256</q:Major>\n<q:Minor>8</q:Minor>\n<q:Patch>2</q:Patch>\n<q:Buildnumber>117981</q:Buildnumber>\n<q:Buildtype>1</q:Buildtype>\n<q:Serial>DC15C84450A3</q:Serial>\n<q:OEM>1und1</q:OEM>\n<q:Lang>de</q:Lang>\n<q:Country>049</q:Country>\n<q:Annex>B</q:Annex>\n<q:Flag>crashreport</q:Flag>\n<q:Flag>avm_acs</q:Flag>\n<q:Flag>medium_lan</q:Flag>\n<q:Flag>medium_mobile</q:Flag>\n<q:Flag>mesh_master_no_trusted</q:Flag>\n<q:UpdateConfig>3</q:UpdateConfig>\n<q:Provider>oma_lan</q:Provider>\n</e:BoxInfo>\n</e:BoxFirmwareUpdateCheck>\n</soap:Body>\n</soap:Envelope>'
<soap:Envelope xmlns:soap="http://schemas.xmlsoap.org/soap/envelope/"><SOAP-ENV:Header xmlns:SOAP-ENV="http://schemas.xmlsoap.org/soap/envelope/"/><soap:Body ID="Body"><ns2:BoxFirmwareUpdateCheckResponse xmlns:ns2="http://juis.avm.de/updateinfo" xmlns:ns3="http://juis.avm.de/response" xmlns:ns4="http://juis.avm.de/request"><ns2:ResponseUpdateInfo><ns3:ResponseHeader><ns3:Nonce>QWsDft/cHi6HBWNRrh9OkQ==</ns3:Nonce></ns3:ResponseHeader><ns3:UpdateInfo><ns3:CheckInterval>48</ns3:CheckInterval><ns3:Found>true</ns3:Found><ns3:Name>EXTERN RELEASE SMART24 P2 NL1 deutsche info.txt</ns3:Name><ns3:Version>256.08.25</ns3:Version><ns3:Type>1</ns3:Type><ns3:DownloadURL>http://download.avm.de/fritzbox/fritzbox-7530-ax/deutschland/fritz.os/FRITZ.Box_7530_AX-08.25.image</ns3:DownloadURL><ns3:InfoURL>http://download.avm.de/fritzbox/fritzbox-7530-ax/deutschland/fritz.os/info_de.txt</ns3:InfoURL><ns3:InfoText></ns3:InfoText><ns3:HintURL></ns3:HintURL><ns3:IconURL></ns3:IconURL><ns3:Priority>1</ns3:Priority><ns3:AutoUpdateStartTime>1800</ns3:AutoUpdateStartTime><ns3:AutoUpdateEndTime>18000</ns3:AutoUpdateEndTime><ns3:AutoUpdateKeepServices>true</ns3:AutoUpdateKeepServices></ns3:UpdateInfo></ns2:ResponseUpdateInfo></ns2:BoxFirmwareUpdateCheckResponse><Signature xmlns="http://www.w3.org/2000/09/xmldsig#"><SignedInfo><CanonicalizationMethod Algorithm="http://www.w3.org/2001/10/xml-exc-c14n#"/><SignatureMethod Algorithm="http://www.w3.org/2001/04/xmldsig-more#rsa-sha256"/><Reference URI="#Body"><Transforms><Transform Algorithm="http://www.w3.org/2000/09/xmldsig#enveloped-signature"/></Transforms><DigestMethod Algorithm="http://www.w3.org/2001/04/xmlenc#sha256"/><DigestValue>Gh+GVFub448aG1n4n2a6MOp9pdg/RvzIWPHbYlLmNZk=</DigestValue></Reference></SignedInfo><SignatureValue>U7I0bqyc/WGSxWoYUsOxuuFKqBJ+02U+0j5XzhP7xtgvCtE+IuzJrU4plgYKALtAhJ9nJTxWjB3/iA95Q59ncMi4WkPVUhATXcxCPxZarjmSLhnmOmsJ6OZhO9OxVCUzQ43WXc8YmsD4l9G9RD/8KFNg/5mpm4WMlT9kjxaFGJw3Cq/nwRCt0SwkWct0170797SaxcKsdbSjPxlJe3BO1nyo/cCD1fI5yVx0MoOPM775cI1MvGbcpl/1GHFkiqAQU3WlW2RW2TrKsoWTnwTdJjT6jgjP1wBeCJTXQXfpdgg5C2qkM3Gu1jytJKf8QZc5/do5D3j2sCn4bl94rrdWzw==</SignatureValue></Signature></soap:Body></soap:Envelope>
```

**Comment by fda77** [comment]
Das funktioniert doch recht gut, halt mit deinem "Bearer"!

Deine Anfrage auf 8.20 geändert:
```
curl 'https://jws.avm.de:443/Jason/UpdateInfoService' \
  --silent \
  --cacert 'tools/avm-rootca.pem' \
  -X POST \
  -H 'Host: jws.avm.de' \
  -H 'Authorization: Bearer eyJraWQiOiJNQV9xSzY5UDVaS1h0UkdwZExmLTFSRHkxVkJMWVl2Vko0Um1EZXpCMl9nIiwiYWxnIjoiUlMyNTYifQ.eyJhdWQiOlsid2Vic2VydmljZS5teWZyaXR6Lm5ldCIsImp3cy5hdm0uZGUiLCJhcGkuYXZtLmRlIl0sInN1YiI6IkRDMTVDODQ0NTBBMyIsImlzcyI6Imh0dHBzOi8vZGNhLmF2bS5kZS9mcml0em9zL2F1dGhvcml6YXRpb24vdjEvdG9rZW4iLCJjbmYiOnsieDV0I1MyNTYiOiJScGhsTXhVUkhJeElLRWFRYVhfVVBfVHZhSGFUYWNJYVVqZy1XMkdUN280In0sImV4cCI6MTc4MTQ0NjA5NCwiaWF0IjoxNzgxNDQyNDk0LCJqdGkiOiI2ZGIxMmUyMS04NjI2LTQ4YjMtODdhOC1iY2UwMTNhY2NkNmYiLCJjbGllbnRfaWQiOiJEQzE1Qzg0NDUwQTMiLCJoYXJkd2FyZV9pZCI6MjU2LCJjZXJ0aWZpY2F0ZV9pbmZvIjp7ImxldmVsIjoxLCJtYW51ZmFjdHVyZXJfY2EiOiJBVk0gRGV2aWNlIE1hbnVmYWN0dXJlciBDQSAzNTAyNzc2IiwicHJvZHVjZXJfY2EiOiJBVk0gRGV2aWNlIFByb2R1Y3Rpb24gQ0EgMDg3NTYyMTEgNjU0NzIwMSJ9fQ.O_j1YuYjF4fgTdQOIoIJl2IySHR3veuvls2AHLMXdbh0ZfLybE_E38xiay_CQpmzv92Hjq7imzoCrtwM3wQqC7qUoDPCWbbT9QRsGZgcJnVEbPDV9RNEZF5bw9IJqkzIm0DPpZq977X_QgPUUpUmLuppJ1o6_IFtZReeX2WO--L8UmCsa_dC3Cj5sTmSB5gf9cyX_WVLEI-CpLAJAddZp5m6Vh-GjlQgNjTVcm6poTnkIr4fA5FZR1jYm0CWps_3C4JMRNwjghmoqKK7OlpXnmW5iEFgcyEPDdAYD4xhDOT-uaSfyfOgNxxNlptGi4jA_RSIuD8n2vdp5lt1q5ZPmg' \
  -H 'Content-Type: text/xml; charset=utf-8' \
  --data-binary $'<?xml version="1.0"?>\n<soap:Envelope xmlns:soap="http://schemas.xmlsoap.org/soap/envelope/" xmlns:e="http://juis.avm.de/updateinfo" xmlns:q="http://juis.avm.de/request">\n<soap:Header/>\n<soap:Body>\n<e:BoxFirmwareUpdateCheck>\n<e:RequestHeader>\n<q:Nonce>QWsDft/cHi6HBWNRrh9OkQ==</q:Nonce>\n<q:UserAgent>Box</q:UserAgent>\n<q:ManualRequest>true</q:ManualRequest>\n</e:RequestHeader>\n<e:BoxInfo>\n<q:Name>FRITZ!Box 7530 AX (UI)</q:Name>\n<q:HW>256</q:HW>\n<q:Major>256</q:Major>\n<q:Minor>8</q:Minor>\n<q:Patch>2</q:Patch>\n<q:Buildnumber>117981</q:Buildnumber>\n<q:Buildtype>1</q:Buildtype>\n<q:Serial>DC15C84450A3</q:Serial>\n<q:OEM>1und1</q:OEM>\n<q:Lang>de</q:Lang>\n<q:Country>049</q:Country>\n<q:Annex>B</q:Annex>\n<q:Flag>crashreport</q:Flag>\n<q:Flag>avm_acs</q:Flag>\n<q:Flag>medium_lan</q:Flag>\n<q:Flag>medium_mobile</q:Flag>\n<q:Flag>mesh_master_no_trusted</q:Flag>\n<q:UpdateConfig>3</q:UpdateConfig>\n<q:Provider>oma_lan</q:Provider>\n</e:BoxInfo>\n</e:BoxFirmwareUpdateCheck>\n</soap:Body>\n</soap:Envelope>'  | \
| sed 's,><,>\n<,g' | sed 's,</.*,,g;s/.*>$//g| sed '/^$/d''
```


Korrekte Antwort mit 8.25:
```
<ns3:Nonce>QWsDft/cHi6HBWNRrh9OkQ==
<ns3:CheckInterval>48
<ns3:Found>true
<ns3:Name>EXTERN RELEASE SMART24 P2 NL1 deutsche info.txt
<ns3:Version>256.08.25
<ns3:Type>1
<ns3:DownloadURL>http://download.avm.de/fritzbox/fritzbox-7530-ax/deutschland/fritz.os/FRITZ.Box_7530_AX-08.25.image
<ns3:InfoURL>http://download.avm.de/fritzbox/fritzbox-7530-ax/deutschland/fritz.os/info_de.txt
<ns3:Priority>1
<ns3:AutoUpdateStartTime>1800
<ns3:AutoUpdateEndTime>18000
<ns3:AutoUpdateKeepServices>true
<DigestValue>Gh+GVFub448aG1n4n2a6MOp9pdg/RvzIWPHbYlLmNZk=
<SignatureValue>U7I0bqyc/WGSxWoYUsOxuuFKqBJ+02U+0j5XzhP7xtgvCtE+IuzJrU4plgYKALtAhJ9nJTxWjB3/iA95Q59ncMi4WkPVUhATXcxCPxZarjmSLhnmOmsJ6OZhO9OxVCUzQ43WXc8YmsD4l9G9RD/8KFNg/5mpm4WMlT9kjxaFGJw3Cq/nwRCt0SwkWct0170797SaxcKsdbSjPxlJe3BO1nyo/cCD1fI5yVx0MoOPM775cI1MvGbcpl/1GHFkiqAQU3WlW2RW2TrKsoWTnwTdJjT6jgjP1wBeCJTXQXfpdgg5C2qkM3Gu1jytJKf8QZc5/do5D3j2sCn4bl94rrdWzw==

```

Dh alles ist wie bisher, nur muss ein Bearer-Header dazu.

Wie man den abfragt bzw wo das client-certificate her bekommt ist noch offen

**Reply by LizenzFass78851** [reply]
> Wie man den abfragt bzw wo das client-certificate her bekommt ist noch offen

> `curl: (56) OpenSSL SSL_read: OpenSSL/3.5.5: error:0A00045C:SSL routines::tlsv13 alert certificate required, errno 0`

Es gibt client Zertifikate auf jeder Fritzbox die für mTLS bei der Anfrage an `dca.avm.de` verwendet werden

Die Zertifikate bekommt man dort:

```
cat /proc/avm/calib/avmzertifikate > /tmp/avmzertifikate.tar.gz
```

Die cer Dateien und die bin müssen in ein PEM Format konvertiert werden und die Certs als CA-Kette.pem gespeichert werden.
**Weitere versuche belaufen sich auf:**
```
{"error":"invalid_client","error_description":"Client authentication failed, e.g. unknown client, no client authentication included, or unsupported authentication method. If the client considers to have valid client credentials from its point of view but this error code is returned, the client MUST discarded all OAuth related configuration values and stop any further interaction."}
```

**Reply by fda77** [reply]
Ist ja witzig. Ich hab sogar ein Gerät mit Zertifikaten, auch wenn es eine HWR < 277 ist

```
cat /proc/avm/calib/avmzertifikate | tar tvzf -
-rwxrwxrwx 0/0       874 2021-10-18 23:31:58 avm_dev_cert.cer
-rwxrwxrwx 0/0      1218 2021-10-18 23:31:58 avm_dev_key_prv.bin
-rwxrwxrwx 0/0      1013 2021-10-18 23:31:57 avm_dev_man_ca.cer
-rwxrwxrwx 0/0       780 2021-10-18 23:31:57 avm_dev_prod_ca.cer
```
Welches hast du verwendet?

**Reply by LizenzFass78851** [reply]
> Welches hast du verwendet?

Alle Dateien.
Die ganzen Dateien müssen jeweils in ein PEM Format konvertiert werden und alle Zertifikate ohne Key in eine .pem Datei zusammenfassen und als key der key_prv (auch als PEM Format)

**Reply by fda77** [reply]
Bei boxmatrix gibts dazu auch was zu lesen. Dort steht die 7530 hätte keine Certs. Meine 7520 mit 7530 alien-firmware hat aber welche. Die avm_dev_cert.cer müsste die richtige sein, laut boxmatrix passt das zur maca/serial

**Reply by fda77** [reply]
ich wäre aber vorsichtig beim experimentieren, nicht dass avm seriennummern aussperrt :-)

avm_dev_cert.cer:
```
Subject: C=DE, O=AVM GmbH Berlin, OU=AVM GmbH Berlin, CN=1C:ED:6F:*
        X509v3 extensions:
            X509v3 Subject Alternative Name:
                DNS:MACA=1C:ED:6F:*, DNS:HWRevision=247, DNS:HWSubRevision=3, DNS:SecLevel=1
```

**Comment by fda77** [comment]
@LizenzFass78851 kannst du nochmal einen frischen Bearer posten?

**Reply by LizenzFass78851** [reply]
```
  -H 'Authorization: Bearer eyJraWQiOiJNQV9xSzY5UDVaS1h0UkdwZExmLTFSRHkxVkJMWVl2Vko0Um1EZXpCMl9nIiwiYWxnIjoiUlMyNTYifQ.eyJhdWQiOlsid2Vic2VydmljZS5teWZyaXR6Lm5ldCIsImp3cy5hdm0uZGUiLCJhcGkuYXZtLmRlIl0sInN1YiI6IkRDMTVDODQ0NTBBMyIsImlzcyI6Imh0dHBzOi8vZGNhLmF2bS5kZS9mcml0em9zL2F1dGhvcml6YXRpb24vdjEvdG9rZW4iLCJjbmYiOnsieDV0I1MyNTYiOiJScGhsTXhVUkhJeElLRWFRYVhfVVBfVHZhSGFUYWNJYVVqZy1XMkdUN280In0sImV4cCI6MTc4MTQ1NzQyMiwiaWF0IjoxNzgxNDUzODIyLCJqdGkiOiIwNzc2ODIzZi1hYWMxLTQxOTUtOWNhNi01ZjU2NTNmNWZlZTYiLCJjbGllbnRfaWQiOiJEQzE1Qzg0NDUwQTMiLCJoYXJkd2FyZV9pZCI6MjU2LCJjZXJ0aWZpY2F0ZV9pbmZvIjp7ImxldmVsIjoxLCJtYW51ZmFjdHVyZXJfY2EiOiJBVk0gRGV2aWNlIE1hbnVmYWN0dXJlciBDQSAzNTAyNzc2IiwicHJvZHVjZXJfY2EiOiJBVk0gRGV2aWNlIFByb2R1Y3Rpb24gQ0EgMDg3NTYyMTEgNjU0NzIwMSJ9fQ.CIHqY_wrSG10dxqvaghsAPDExr1p4lcv13o__aqdJThtBwGBn4Q_JFrpISzmynHs7XX5OUWyWsdoExgrCilTkc760n2w-Lz8bWZZPDutyfAoQtqAvPzyH4YrQf0C4JIMAvIPzdIG19fBb6jP6QILSXSJGmNZVRyNS7wgsQR6UjPpJ7NAkNQuiEjFkFbihjklLeVEkP_xybdbbfwoJKH1Mo2HOTeMTcD2DPMYKPTHuryrWtWpOqE7x0br-k15iPzaDj2vd8HUePGvlkWP1eL7NF2tsAJN5FclV-Jn-qfs5iuydfbn-_8cZzol65q9AVxSzQLm6B4G3xeAqVIPYnk75Q' 
```

**Comment by fda77** [comment]
Ich hab mir die sourcen angeschaut, es sieht so aus als ob das zertifikat nicht generiert wird, sondern in einem prom ist:

```
// This struct holds information about the zip types
//
// It will be filled by load_config. If a non-zipped config
// is found on-disk the has_zipped_src flag is cleared.
static struct config_data configs[AVM_PROM_MAX_TYPE] = {
...
	[AVM_PROM_AVMZERTIFIKATE] = { .procfs_export = 1, },
...
```

Da darin also die MAC und HWR ist, könnte es sein dass mit 1 zertifkat es nur für diese HWR möglich ist juis abzufragen.
Damit wäre es für neue Geräte unmöglich neue firmware zu finden.
Für bekannte Geräte könnte man eine datenbank von mac+zertifikat für juis anlegen.
Fraglich ob jemand das rausrückt

**Reply by fda77** [reply]
Noch hinzufügen möchte ich dass es absolut überflüssig ist, die ANFRAGE zu authentifizieren!
Es reicht die ANTWORT vom Gerät prüfen zu lassen, es braucht dann nur einen pub-key.
Mich überrascht wie viel Energie AVM aufgewendet hat, jedem Gerät ein individuelles Zertifikat zu verpassen,
nur um seine Kunden zu gängeln.

**Comment by fda77** [comment]
Muss man schauen. Wie gesagt, wenn man zu oft eine Serial nimmt, könnte die verbrennen...

Probiere du, mein Geräte darf es VERMUTLICH nicht weil die HWR zu alt und es nicht "freigeschaltet" ist:

```
openssl x509 -inform der -in avm_dev_cert.cer -out avm_dev_cert.cer.pem
openssl pkey -inform DER -in avm_dev_key_prv.bin -out avm_dev_key_prv.bin.pem

$ file *.pem
avm_dev_cert.cer.pem:    PEM certificate
avm_dev_key_prv.bin.pem: OpenSSH private key (no password)


$ openssl x509 -noout -modulus -in x/avm_dev_cert.cer.pem | openssl md5
$ openssl rsa  -noout -modulus -in x/avm_dev_key_prv.bin.pem | openssl md5
beide md5 gleich!



curl 'https://dca.avm.de/fritzos/authorization/v1/token' \
  -X POST \
  -H 'Content-Type: application/x-www-form-urlencoded' \
  -H 'Connection: close' \
  --data 'client_id=DEINE-MACA-OHNE_PUNKTE' \
  --cacert 'tools/avm-rootca.pem' \
 --cert avm_dev_cert.cer.pem \
 --key avm_dev_key_prv.bin.pem \

curl: (56) OpenSSL SSL_read: OpenSSL/3.5.5: error:0A000418:SSL routines::tlsv1 alert unknown ca, errno 0
```

statt tools/avm-rootca.pem aus freetz geht auch /etc/avm_root_ca.pem auf der box

**Reply by LizenzFass78851** [reply]
Die Fehlermeldung hatte ich auch.
Dazu die 3 Zertifikate:

```
avm_dev_cert.pem
avm_dev_man_ca.pem
avm_dev_prod_ca.pem
```

mit:

```
cat avm_dev_cert.pem avm_dev_man_ca.pem avm_dev_prod_ca.pem > avm_dev_all_ca.pem 
```

Alle 3 Certs in ein eine pem Datei bündeln weil alle 3 Teil einer Zertifikatskette sind, die nur gebündelt funktioniert.
Der priv_key muss weiterhin seperat behandelt werden.

**Reply by fda77** [reply]
Das sieht schon besser aus
```
{"error":"invalid_client","error_description":"Client authentication failed, e.g. unknown client, no client authentication included, or unsupported authentication method. If the client considers to have valid client credentials from its point of view but this error code is returned, the client MUST discarded all OAuth related configuration values and stop any further interaction."}
```
und was bekommst du?

**Reply by LizenzFass78851** [reply]
Das gleiche siehe: https://github.com/orgs/Freetz-NG/discussions/1415#discussioncomment-17298654

**Comment by fda77** [comment]
Vielleicht weil auch deine HWR256 zu alt ist? Aber der ctlmgt bekommt doch einen token

**Reply by LizenzFass78851** [reply]
Warscheinlich könnte es an den binaryblob liegen.
Wenn man die client_id und die Certs mitgibt, dann könnte es den Binaryblob liegen der nach der client_id zu sehen ist.

**Reply by fda77** [reply]
dieses blob hinter der client_id müsste das zertifikat sein! Im ltrace wurd es nur angezeigt. Die content-length sagt auch dass nach der client_id ende des requests ist (tls ist ein anderer layer)

**Comment by fda77** [comment]
klappt, die Reihenfolge war falsch:

```


cat avm_dev_cert.pem avm_dev_prod_ca.pem avm_dev_man_ca.pem > avm_dev_cert_chain.pem 


curl 'https://dca.avm.de/fritzos/authorization/v1/token' \
  -X POST \
  -H 'Content-Type: application/x-www-form-urlencoded' \
  -H 'Connection: close' \
  --data 'client_id=XX1234567890' \
  --cacert '../tools/avm-rootca.pem'  \
--cert avm_dev_cert_chain.pem \
--key avm_dev_key_prv.pem \
 | jq


{
  "access_token": "eyJraWQiOiJNQV9xSzY5UDVaS1h0UkdwZExmLTFSRHkxVkJMWVl2Vko0Um1EZXpCMl9nIiwiYWxnIjoiUl...",
  "token_type": "Bearer",
  "expires_in": 3600
}

``´

**Comment by fda77** [comment]
tools/juis_check verwendet jetzt falls vorhanden ~/.juis_bearer in dem sich ein gültiger token (und nur dieser) befindet.
Ich hatte aber nur für meine hwr ergebnisse erhalten, das muss man aber noch genauer prüfen wenn mal jemand ein neuere Gerät mit "avmzertifkate" hat.
Das Zertifikates enthäöt als Serial übrigens auch nochmal die maca.
Die Einführung dieser avmzertifikate könnte etwa in die Zeit fallen ab der man manche environment variablen wie das branding nicht mehr ändern kann

**Reply by LizenzFass78851** [reply]
> Ich hatte aber nur für meine hwr ergebnisse erhalten

Das stimmt, ich habe das mit meinen Token nachgeprüft und habe nur Ergebnise für meine Test Box erhalten, ob wohl ich von HWR 150 bis 400 getestet habe. Damit scheint es so zu seien, das der Token an die HWR (aus den Zertifikat) gebunden ist.

```
./generate.sh

### FOS-Release ################################################
256=http://download.avm.de/fritzbox/fritzbox-7530-ax/deutschland/fritz.os/FRITZ.Box_7530_AX-08.25.image

### FOS-Downgrade ##############################################
256=http://download.avm.de/fritzbox/fritzbox-7530-ax/deutschland/fritz.os/FRITZ.Box_7530_AX-08.25.image
```

**Reply by fda77** [reply]
Hatte ich auch so, und man kann dann davon ausgehen dass via juis keine neuen Geräte mehr zu finden gibt. Dann müss man halt die Download-urls generieren und alles abklappern..

Damit wird auch die ganze "inhaus" Nutzung eingedämmt, wobei ich nie verstanden hatte weshalb man sich ein firmware installieren wollte bei der jede neue Version noch mehr Fehler als die letzte enthält. Eigentlich bräuchte avm die überhaupt nicht auf öffentlich Server zu packen und der Welt einen Gefallen tun :)

Für die "labor" könnte man wenn man unbedingt wollte https://fritz.com/pages/fritz-labor-8-24 parsen. Da AVM aber kein GPL-Sourcen trotz Nachfragen herausrückt, weil die ja nicht öffentlich wären oder so, aber für einen evtl neuen kernel nötig wären spar ich mir die Zeit. Wirklich neue und interessant Features gibts da schon lange nicht mehr.
Was innovatives und neumodische wäre für mich mal ein überfälliges "dark theme" fürs webif oder endlich Vlans

**Comment by fda77** [comment]
AVM hat übrigens vergessen anzugeben dass schon bei der Updatesuche eine eindeutige und nicht änderbare Identifizierung, nämlich die MAC mitgesendet wird und nicht nur die aktuelle Firmware-Version.

<details>
<img width="745" height="608" alt="image" src="https://github.com/user-attachments/assets/2311b0bd-c63f-4d6d-b1f2-d2852ab39d67" />
</details>

Wenn man bedenkt dass zb Apple + Google Smartphones hin zu anonymen bzw bei jedem Verbindungsaufbau neu generierten MAC gehen, läuft es bei AVM komplett in die falsche Richtung

**Comment by fda77** [comment]
@LizenzFass78851 

hast du eine Idee mit welchem pub-key avm die signatur im ""access_token"" validiert?

Beim testen mit dem juis-script musst du aufpassen, da die HWR aktuell aus dem access_token gelesen wird! Am besten diese Zeile auskommentieren: https://github.com/Freetz-NG/freetz-ng/blob/master/tools/juis_check#L97

**Reply by LizenzFass78851** [reply]
Wenn damit die 3 Zertifikate gemeint sind, dann aus alle 3. (primär das dev_cert) 
Die 3 Zertifikate sind Teil einer Zertifikatskette.

Da dort auch der private key mit da liegt, könnte mit den private key das dev_cert modifiziert generieren (die Zertifikatskette beachten)
Kann aber auch nicht funktionieren wenn der private key nicht für das dev_man oder dev_prod Zertifikat funktioniert.

**Reply by fda77** [reply]
Ich meine das Feld "access_token" in dem bearer den man von dca.avm.de zurück bekommt
Diesenr hat 3 Felder dir mit "." getrennt sind: header, payload und signatur (256 bytes)
Das 3 signiert das 1.+2.
Im header gibt es das Feld "kid" das wohl die CA bezeichnet gegen die man valdidieren muss.
Ich GLAUBE das ist weder das https-cert vom server noch aus diesem "avmzertikat" - es klappt jedenfalls nicht

In /lib/libcmapi.so.1.0.0 hab ich diese "strings" gefunden:
```
ar7/ctlmgr/src/cmapi/oauth_handler.c
%s() failed with status code (%d)
%s(): oauth2_token_add(..) failed with error code (%d)
%s(): oauth2_token_get(..) failed with error code (%d)
%s(): pending request of type(%s) is taking too long. restart the associated actions
%s(): liboauth_controller_init(..) failed with error code (%d)
%s(): unknown service (%d). couldn't refresh state
%s(): register_time_known_event(..) failed. fallback: set the service state 'oss_service_ready' immediately
%s(): enqueue_service_request(..) failed with code (%d)
%s() illegal service type=%d
%s(): requesting token for '%s' failed with code (%d)
%s(): unknown service
ar7/ctlmgr/src/cmapi/oauth_avm_json.cpp
access_token
token_type
error_description
%s(): jwk_rsa_keyset_parse(..) failed with error code(%d)
%s(): parse_kid_from_jws_object(..) failed with code (%d)
%s(): jws_rsa256_check_signature(..) failed with code(%d)
%s(): yajl_status is: %d
ar7/ctlmgr/src/cmapi/oauth_token_handler.c
%s(): liboauth_token_myfritz_compare(..) failed. A change notification may have been missed.
%s(%s): length(%zi), type(%s), expiration-time(%s)
%s(): specific token(%s)
%s(): token(%s)
%s can't get name of PEM file for device certificate
client_id=%s
https://dca.avm.de/fritzos/authorization/v1/token
ar7/ctlmgr/src/cmapi/oauth_devicecert.c
%s(): devicecert_oauth_get_token(..) failed with error code (%d)
oauth2_error
oauth2_info
 [cut]
%s(): getting %s-token failed (HTTP %i)
%s(): avm_error(%s): %.*s%s
```
Vielleicht findet man mit ltrace was, aber ich kenne mich damit nicht aus.
Auch ist mir nicht klar ob "avmzertikat" noch für mehr als juis verwendet wird

**Reply by LizenzFass78851** [reply]
Ich habe es mit ltrace mit folgenden Befehl:

```bash
ltrace -f -s 16384 \
-e 'liboauth_*' \
-F /var/mod/etc/ltrace.conf \
-p $(pidof ctlmgr)
```

Mit Folgende ltrace.conf

```c
int liboauth_controller_get_avm_access_token(string, string, int, string);

int liboauth_controller_update_service_state(int, int, string, string);

int liboauth_controller_get_service_config(int, string, string, int);

int liboauth_controller_get_service_state(int, string, int, string);
```

Mit folgenden Ergebnis:

```
[pid 7997] liboauth2.so.1->liboauth_controller_get_avm_access_token("", "\324<|\266\001vic\320\002|\253\330wq\253\244\226\242\266\250\245\242\266,\246\242\266e", 0, "" <unfinished ...>
[pid 7997] libcmapi.so.1->liboauth_controller_update_service_state(0, 0, "\374\375\376\377", nil)                     = 0
[pid 7997] libcmapi.so.1->liboauth_controller_get_service_config(1, nil, nil, 1)                                      = 1
[pid 7997] libcmapi.so.1->liboauth_controller_update_service_state(1, 1, "()*+,-./0123456789:;<=>?@ABCDEFGHIJKLMNOPQRSTUVWXYZ[\\]^_`abcdefghijklmnopqrstuvwxyz{|}~\177\200\201\202\203\204\205\206\207\210\211\212\213\214\215\216\217\220\221\222\223\224\225\226\227\230\231\232\233\234\235\236\237\240\241\242\243\244\245\246\247\250\251\252\253\254\255\256\257\260\261\262\263\264\265\266\267\270\271\272\273\274\275\276\277\300\301\302\303\304\305\306\307\310\311\312\313\314\315\316\317\320\321\322\323\324\325\326\327\330\331\332\333\334\335\336\337\340\341\342\343\344\345\346\347\350\351\352\353\354\355\356\357\360\361\362\363\364\365\366\367\370\371\372\373\374\375\376\377", "\377") = 0
```

Weiter hilft das warscheinlich nicht und unter welchen Symbole der libcmapi.so diese abarbeitung geschied, kann ich so nicht sagen.

-----


Bei ltrace gibt man `-e` die Symbole einer Libary ein unter den ein Prozess das versucht von einer Libary zu erfragen.
`-F` ist die ltrace.conf wo man in c definiert was die Ausgabe eines Vorgangs von einen Symbol einer Libary interpretiert wird.

Symbole bekommt man mit `nm -D lib/libcmapi.so.1` oder `strings -a lib/libcmapi.so.1`

**Comment by fda77** [comment]
Als mein größtes Problem ist dass ich nur 1 geräte mit avmzertifikat habe, und das mein DSL modem ist.
Und bekanntlich bestraft die Telekom Reconnect mit 3 wöchiger Bandbreitenreduzierung - aktuelle bin ich froh dass die Gammelleitung am Maximum von 50 mbit synchronisiert...
Wenn du deine Ausgabe von oben einer KI zeigst rätselt sie mit. zb werden so Hexbytes ausgegen "ltrace -s 4096 -xx -f <programm>". Oder dass der 2. Parameter von get_avm_access_token  interessant wäre
Bei 1024bit sollte der pubkey 128bytes haben, bzw 256bytes bei 2048bit

**Reply by LizenzFass78851** [reply]
> Im header gibt es das Feld "kid" das wohl die CA bezeichnet gegen die man valdidieren muss.
> Ich GLAUBE das ist weder das https-cert vom server noch aus diesem "avmzertikat" - es klappt jedenfalls nicht

Mit ltrace und strace komme ich nicht weiter. 
Welcher public key verwendet wird um die kid zu validieren, habe ich so nicht herausfinden können.

Dazu ist unklar ob der dafür passende public key in der Firmware liegt oder ob der Public Key beim AVM Server liegt wo man kaum einfluss hätte. 
Auch unklar ist ob es nur ein Public Key gibt oder ob es für jedes Gerät einen eigenen Public Key gibt, was für die validierung von kid verwendet wird.

-----

> dass der 2. Parameter von get_avm_access_token interessant wäre

Habe ich mit ltrace versucht anzeigen zu lassen aber es sind nur unerkennbare Daten (diesmal ohne unfiniched)

```
[pid 9082] liboauth2.so.1->liboauth_controller_get_avm_access_token("", "\324|{\266\001vic\310\363\337\264\360\305\022\263\244\326\241\266\250\345\241\266,\346\241\266me", 0, "") = 0
```

**Reply by fda77** [reply]
Diese \123\345... dinger sind einfach bytes die man mit zb printf ausgeben kann. Evtl "hexdump -C" dahinter zum anschauen. Oder "base64 -d"
Ein pubkey könnte  binär vorliegen. Ob er von einem Webserv heruntergeladen wird müsste man doch sehen. Bei jwt ist das eigentlich üblich

**Comment by fda77** [comment]
Ich hab HW 247 + 256 verglichen. beide:
```
Header:
{
  "kid": "MA_qK69P5ZKXtRGpdLf-1RDy1VBLYYvVJ4RmDezB2_g",
  "alg": "RS256"
}
```
die key-id der signatur ist bei beiden gleich.

aber

```
Payload:
  "hardware_id": 247,
  "certificate_info": {
    "manufacturer_ca": "AVM Device Manufacturer CA 3502776",
    "producer_ca": "AVM Device Production CA 08756104 23040627"
  }
}
```
```
  "hardware_id": 256,
  "certificate_info": {
    "manufacturer_ca": "AVM Device Manufacturer CA 3502776",
    "producer_ca": "AVM Device Production CA 08756211 6547201"
  }
}
```
Ich deute das so das verschieden sub-ca gibt, vermutlich pro HWR

**Reply by LizenzFass78851** [reply]
Mit einen Aufruf auf:

```bash
curl 'https://dca.avm.de/fritzos/authorization/v1/jwks' \
  --cacert 'avm-rootca.pem'  \
--cert avm_dev_cert_chain.pem \
--key avm_dev_key_prv.bin.key | jq
```

habe ich folgendes Ergebnis erhalten:

```json
{
  "keys": [
    {
      "kty": "RSA",
      "e": "AQAB",
      "use": "sig",
      "kid": "MA_qK69P5ZKXtRGpdLf-1RDy1VBLYYvVJ4RmDezB2_g",
      "alg": "RS256",
      "n": "ua8a04sFusjBGGQdv-pLQIvejy9mzkDu15Z3AGrnGZzw-v3Ns3APxzm85oVQmJRt7EbvQO3-OnleT2ypOaA2Cems1y2X110hxmt5XAWVOapkvPD4OpdSi9FlzCaxWWFY62suU_N62MFLrbCl0IbOgrlfEsZMGGO6cPPAoDvpa1IHhgEVpcwKE7I40WwWfmNzyntSlEaz-BP-O29Yjq2j2rN1kGEl---4T9rx16FdqpETaJm1kXTar30L4NHZlQOznYwgcgnMWn505oylT9hXHnxB5affCDznkZJt_uzC_6aUY_F5n4zIMkvZWHD7cziBUNKitltsKVOHNL45hADB2Q"
    }
  ]
}
```

**Reply by fda77** [reply]
Wie hast du denn diese URL gefunden? Ich hatte auch herumprobiert, aber mit weniger Glück.
Mit diesem Key sagt openssl: "Verified OK" :)

**Reply by LizenzFass78851** [reply]
Ich habe da ich auch dazu nicht weiter wusste, eine <sup>AI</sup> gefragt. 
Da hat die <sup>AI</sup> 4 verschiedene URLs vorgeschlagen und eine URL davon hat somit funktioniert.

<img width="512"  alt="Screenshot 2026-06-27 at 11-38-50 ltrace Klartext anzeigen" src="https://github.com/user-attachments/assets/a48c7299-02d5-461e-9176-3a700edb315e" />

Die von <sup>AI</sup> genannte Referenz: https://ssojet.com/docs/en/oidc/jwks

**Comment by fda77** [comment]
Mir ist noch aufgefallen dass bei einem juis-request mit token, in "Serial" die gleiche "maca" stehen muss die beim abrufen des Trokens und damit im dev-cert genutzt wurde

**Comment by fda77** [comment]
Hab das hier zusammengefasst: https://freetz-ng.github.io/freetz-ng/NEWS/#2026-06-22
Theoretisch sollte das nun auf der fritzbox im webif und beim make bei detect und bei der juis action funktionieren.
@LizenzFass78851 Vielleicht hast du Zeit um ein bisschen zu testen
Es fehlen nur noch die ganzen "avmzertifikate" für die hwr ab 277. Vielleicht finden sich "Spender"...

**Reply by LizenzFass78851** [reply]
juis_check verwendet kein mTLS.

Folgendes war bei `sh -x /usr/bin/juis_check --https` Ausgegeben:

```
+ local 'MTLS=y'
+ '[' 256 -eq 265 ]
+ '[' 256 -ge 277 ]
+ '[' -x /usr/bin/juis_bearer ]
+ '[' -e /etc/.freetz-ng-version ]
+ grep -q '^FREETZ_ADD_JUIS_CHECK__MTLS='"'"'y'"'" /etc/options.cfg
+ MTLS=n
```

**Comment by fda77** [comment]
Die patches/scripts/900-add_options_cfg.sh sucht nur nach .sh und .cgi für Sachen die in der options.cfg landen. Die beiden juis Scripte haben aber keine .sh endung, daher f9d3404ef2

Kannst du zum testen einfach so hinzufügen: vix /etc/options.cfg

Was ich noch vergessen hab, es wird (sollte) nur ein neuer token abgerufen werden, wenn der alte weniger als 60 Sekunden gültig ist

**Reply by LizenzFass78851** [reply]
> Kannst du zum testen einfach so hinzufügen: vix /etc/options.cfg

Mit den hinzufügen der Option `FREETZ_ADD_JUIS_CHECK__MTLS` funktioniert nun die `grep` Logik.

```
cat options.cfg | grep "FREETZ_ADD_JUIS_CHECK__MTLS"
FREETZ_ADD_JUIS_CHECK__MTLS='y'
```

```
grep -q '^FREETZ_ADD_JUIS_CHECK__MTLS='"'"'y'"'" options.cfg && echo ON || echo OFF
ON
```

Daher gehe ich davon aus das das es funktionieren sollte wenn `grep -q '^FREETZ_ADD_JUIS_CHECK__MTLS='"'"'y'"'" /etc/options.cfg` Errorcode 0 liefert und dadurch `MTLS=y` gesetzt bleibt.

https://github.com/Freetz-NG/freetz-ng/blob/8d1edaeaf58748206c4584174443f31743070a8d/tools/juis_check#L173

**Reply by LizenzFass78851** [reply]
> Kannst du zum testen einfach so hinzufügen: vix /etc/options.cfg

Habe ich diesmal nicht gemacht nachdem ich das Image mehre Tage später neugebaut habe.
Die Option war diesmal trotzdem in der options.cfg zu sehen (Vieleicht seit: https://github.com/Freetz-NG/freetz-ng/commit/f9d3404ef2f719b06e0804ab8deb584e45623409):

```
root@fritz-bridge-lte:/var/mod/root# ls -la /etc/options.cfg
-rw-r--r--    1 root     root           473 Jun 27 08:25 /etc/options.cfg

root@fritz-bridge-lte:/var/mod/root# ls -la /etc/.config
-rw-r--r--    1 root     root         35909 Jun 27 08:25 /etc/.config

root@fritz-bridge-lte:/var/mod/root# cat /etc/options.cfg | grep "JUIS"
FREETZ_ADD_JUIS_CHECK__MTLS='y'
FREETZ_ADD_JUIS_CHECK__SSL='y'

root@fritz-bridge-lte:/var/mod/root# cat /etc/.config | grep "JUIS"
FREETZ_PACKAGE_JUIS_BEARER=y
FREETZ_PACKAGE_JUIS_BEARER_WITH_DEBUG=y
FREETZ_PACKAGE_JUIS_CHECK=y
FREETZ_PACKAGE_JUIS_CHECK_WITH_SSL=y
FREETZ_ADD_JUIS_CHECK=y
FREETZ_ADD_JUIS_CHECK__SSL=y
FREETZ_ADD_JUIS_CHECK__MTLS=y
FREETZ_ADD_JUIS_CHECK__DEBUG=y
FREETZ_AVM_HAS_JUIS_SUPPORT=y
```

**Comment by LizenzFass78851** [comment]
> Vielleicht hast du Zeit um ein bisschen zu testen

**Stand 27.06.2026**:

- Der juis_bearer Script funktioniert (weiterhin):

```
juis_bearer g
Found and using HWRevision: 256
Saved to file: /mod/root/.juis_bearer/cert/256.tgz
Unpacking source: /mod/root/.juis_bearer/cert/256.tgz
Created certificates: /mod/root/.juis_bearer/pems/256.{pem,key}
Created token: /mod/root/.juis_bearer/auth/256
```

- Mit den juis_check hat das erhalten der Update URL funktioniert:

```
juis_check .
Using SSL:=y
Using mTLS:=y

Response:
################################################################
<ns3:Nonce>MSrwhry7GBgpOjacWF6l/g==
<ns3:CheckInterval>48
<ns3:Found>true
<ns3:Name>EXTERN RELEASE SMART24 P2 NL1 deutsche info.txt
<ns3:Version>256.08.25
<ns3:Type>1
<ns3:DownloadURL>http://download.avm.de/fritzbox/fritzbox-7530-ax/deutschland/fritz.os/FRITZ.Box_7530_AX-08.25.image
<ns3:InfoURL>http://download.avm.de/fritzbox/fritzbox-7530-ax/deutschland/fritz.os/info_de.txt
<ns3:Priority>1
<ns3:AutoUpdateStartTime>1800
<ns3:AutoUpdateEndTime>18000
<ns3:AutoUpdateKeepServices>true
<DigestValue>g6tiH8JxuX2qO7eECvvh7pxLZt53ZucMEHK4jpsKLIM=
<SignatureValue>TWGzaFVfegPfalcq4k+mdpr1kvWSrTiq4WSRp5w5rRfLCfWeMTWvr3xrg6t4Wr+qzW5RRQxa4Eyh8d9kSr12oXu1R4O6KwrFMGsB0vujrdpgxCyk/8LXtkHpl5qKD2KI6DXbQsA+YUY3Hv01LK9mmPQQw0EsWqNRKyrRtwvGJTnZwVtnEkEOx1XP4roYyffCRS4CdWLfB2g0tk6CxgoiemuIz/mcZuPbG6KMaEVesdYNo7NLIgXNc2kjrbkhpA3prGHA2A3xyNcU1fr6s1HcEYnGNOjM+vfN8RdokCUZAvZn3r+4NFxvcCJSVskc2SpQ3XeI4pZ7LSqR2mcGkMzhZg==
################################################################ 
```

Die Antwort kam erst nach dem `ManualRequest` auf `true` steht.

- In der WebIF kam kein solches Ergebnis (auch nicht nach mehreren Versuchen):

<img width="935" height="222" alt="Screenshot 2026-06-27 at 09-00-52 Freetz @fritz-bridge-lte – juis_check" src="https://github.com/user-attachments/assets/e6e76e57-6e36-4ab3-a86c-a423fc77c74a" />

**Edit**: https://github.com/Freetz-NG/freetz-ng/commit/7da462c8d49daafe7127217c6e7e32c9e359aa0e

**Comment by fda77** [comment]
Auf der Fritzbox wird für juis ausgeführt: make/pkgs/mod/files/root/usr/bin/juis
und man kann es auf der Fritzbox mit `juis debug` starten, wie das Webif es macht

Im Script wird übergeben:
```
JUIS="Version=$MAJOR.$VER-$REV Serial=$MAC Nonce=$NONCE"
```

Aber "Serial" wird bei mtls überschrieben, da es ansonsten nicht funktioniert.

**Reply by LizenzFass78851** [reply]
Ich bin mir nicht sicher aber wird bei den WebIF wenn es `juis` ausführt, der Parameter `ManualRequest=true` mit übergehen? Weil in meinen [test](https://github.com/orgs/Freetz-NG/discussions/1415#discussioncomment-17452491) hatte es nur dann was gefunden wenn es mit `ManualRequest=true` stand. Ohne `ManualRequest` kam bei `juis_check` keine URL zurück. (vermutlich weil AVM bei Geräten mit 08.02 noch kein Automatisches Update auf 08.2X freigibt.)

**Reply by fda77** [reply]
Ich bin nicht 100% sicher wie es im Script auf der Box ist, aber wenn der Wert nicht gesetzt ist kommt was zufälliges

```
[ -z "$ManualRequest" ] && ManualRequest="$(echo 'true false' | sed 's/ /\n/g' | shuf | head -n1)"
```

Führ es einfach ein paal mal aus, mit "debug" sieht man die Werte

**Reply by fda77** [reply]
jetzt immer true: 4990bf023e

**Comment by fda77** [comment]
Jetzt müsste man nur noch ein paar `avmzertikate` bekommen, die könnte man auch ein die juis-action einfügen. Wie vielen deiner Geräten haben einen?

**Reply by LizenzFass78851** [reply]
1. 7530 AX v1 (unter HWR 277)
2. 3490 (unter HWR 277)
3. 6490 (unter HWR 277)
4. 7520 (unter HWR 277)

Ab HWR 277 habe ich keine FB in besitz.

**Reply by fda77** [reply]
~~hat die 6490 eine /proc/avm/calib/avmzertifikate ?~~

**Reply by fda77** [reply]
Alle Geräte die diese "Kernel"-sourcen nutzen sollen ein avmzertifikat haben: 1515b42f09
Es sind dort aber nicht alle "Geräte" aufgelistet, da zB 6660 die sourcen einer anderen puma7 box nutzt!
